name,link
"Bắt 3 đối tượng, thu giữ hơn 10 nghìn viên ma túy tổng hợp ở Đồng Nai",https://nhandan.vn/bat-3-doi-tuong-thu-giu-hon-10-nghin-vien-ma-tuy-tong-hop-o-dong-nai-post715653.html
Tạm đình chỉ hoạt động cơ sở karaoke Trump và Beer club Tiktok ở Cà Mau,https://nhandan.vn/tam-dinh-chi-hoat-dong-co-so-karaoke-trump-va-beer-club-tiktok-o-ca-mau-post715486.html
Làm rõ vụ 52 đối tượng dương tính với ma túy trong quán LV Club ở Đồng Nai,https://nhandan.vn/lam-ro-vu-52-doi-tuong-duong-tinh-voi-ma-tuy-trong-quan-lv-club-o-dong-nai-post715758.html
Phát hiện bãi tập kết trái phép hơn 60m3 gỗ quý ngay giữa trung tâm thành phố Buôn Ma Thuột,https://nhandan.vn/phat-hien-bai-tap-ket-trai-phep-hon-60m3-go-quy-ngay-giua-trung-tam-thanh-pho-buon-ma-thuot-post715794.html
"Khởi tố Phó Giám đốc Văn phòng đăng ký đất đai tỉnh Đồng Nai, Chi nhánh Long Thành",https://nhandan.vn/khoi-to-pho-giam-doc-van-phong-dang-ky-dat-dai-tinh-dong-nai-chi-nhanh-long-thanh-post715544.html
"Khởi tố, bắt tạm giam 3 cán bộ quản lý thị trường ở Bình Thuận",https://nhandan.vn/khoi-to-bat-tam-giam-3-can-bo-quan-ly-thi-truong-o-binh-thuan-post715539.html
"Thí điểm hỗ trợ, khuyến khích doanh nghiệp tự nguyện tuân thủ pháp luật hải quan",https://nhandan.vn/thi-diem-ho-tro-khuyen-khich-doanh-nghiep-tu-nguyen-tuan-thu-phap-luat-hai-quan-post715528.html
Đồng Tháp: Phát hiện nhóm sử dụng ma túy trong phòng hát,https://nhandan.vn/dong-thap-phat-hien-nhom-su-dung-ma-tuy-trong-phong-hat-post715511.html
Tạm đình chỉ hoạt động cơ sở karaoke Trump và Beer club Tiktok ở Cà Mau,https://nhandan.vn/tam-dinh-chi-hoat-dong-co-so-karaoke-trump-va-beer-club-tiktok-o-ca-mau-post715486.html
Xử lý nghiêm tình trạng xâm hại trẻ em,https://nhandan.vn/xu-ly-nghiem-tinh-trang-xam-hai-tre-em-post715441.html
"Thụy Sĩ ngừng trao đổi thông tin thuế, hủy quy định thị thực với Nga",https://nhandan.vn/thuy-si-ngung-trao-doi-thong-tin-thue-huy-quy-dinh-thi-thuc-voi-nga-post715630.html
Phía Đông Đài Loan (Trung Quốc) lại hứng chịu trận động đất mạnh,https://nhandan.vn/phia-dong-dai-loan-trung-quoc-lai-hung-chiu-tran-dong-dat-manh-post715763.html
Hơn 3.600 doanh nghiệp tham dự Hội chợ ASEAN-Trung Quốc,https://nhandan.vn/hon-3600-doanh-nghiep-tham-du-hoi-cho-asean-trung-quoc-post715509.html
Thúc đẩy quan hệ đối tác chiến lược Việt Nam-Đức đi vào chiều sâu,https://nhandan.vn/thuc-day-quan-he-doi-tac-chien-luoc-viet-nam-duc-di-vao-chieu-sau-post715799.html
Trung Quốc thu hoạch lớn từ sứ mệnh thám hiểm sao Hỏa đầu tiên,https://nhandan.vn/trung-quoc-thu-hoach-lon-tu-su-menh-tham-hiem-sao-hoa-dau-tien-post715798.html
Thái Lan cân nhắc đánh thuế khí thải carbon,https://nhandan.vn/thai-lan-can-nhac-danh-thue-khi-thai-carbon-post715797.html
Thiệt hại ban đầu sau trận động đất tại Đài Loan (Trung Quốc),https://nhandan.vn/thiet-hai-ban-dau-sau-tran-dong-dat-tai-dai-loan-trung-quoc-post715796.html
"Trung Quốc: Tai nạn xe khách nghiêm trọng, ít nhất 27 người tử vong",https://nhandan.vn/trung-quoc-tai-nan-xe-khach-nghiem-trong-it-nhat-27-nguoi-tu-vong-post715764.html
Làm rõ vụ 52 đối tượng dương tính với ma túy trong quán LV Club ở Đồng Nai,https://nhandan.vn/lam-ro-vu-52-doi-tuong-duong-tinh-voi-ma-tuy-trong-quan-lv-club-o-dong-nai-post715758.html
"Bình Dương: Triệt xóa đường dây mua bán ma túy và thu giữ hơn 1,6kg ma túy",https://nhandan.vn/binh-duong-triet-xoa-duong-day-mua-ban-ma-tuy-va-thu-giu-hon-16kg-ma-tuy-post715673.html
Long An: Bắt giữ đối tượng nhập cảnh mang theo 2 khẩu súng,https://nhandan.vn/long-an-bat-giu-doi-tuong-nhap-canh-mang-theo-2-khau-sung-post715647.html
"Bắt 3 đối tượng, thu giữ hơn 10 nghìn viên ma túy tổng hợp ở Đồng Nai",https://nhandan.vn/bat-3-doi-tuong-thu-giu-hon-10-nghin-vien-ma-tuy-tong-hop-o-dong-nai-post715653.html
"Khởi tố, bắt giam chủ cơ sở karaoke bị cháy ở Bình Dương",https://nhandan.vn/khoi-to-bat-giam-chu-co-so-karaoke-bi-chay-o-binh-duong-post715604.html
Thanh Hóa khởi tố vụ án bắt giữ người trái pháp luật,https://nhandan.vn/thanh-hoa-khoi-to-vu-an-bat-giu-nguoi-trai-phap-luat-post715602.html
"Di lý về Hà Nội đối tượng sát hại nam thanh niên, bắt cóc cô gái ở Láng Hạ",https://nhandan.vn/di-ly-ve-ha-noi-doi-tuong-sat-hai-nam-thanh-nien-bat-coc-co-gai-o-lang-ha-post715595.html
Tạm đình chỉ công tác 5 cán bộ Quản lý thị trường Bình Thuận,https://nhandan.vn/tam-dinh-chi-cong-tac-5-can-bo-quan-ly-thi-truong-binh-thuan-post715578.html
18 cơ sở karaoke ở thành phố Thái Bình vi phạm về phòng cháy,https://nhandan.vn/18-co-so-karaoke-o-thanh-pho-thai-binh-vi-pham-ve-phong-chay-post715562.html
Phía Đông Đài Loan (Trung Quốc) lại hứng chịu trận động đất mạnh,https://nhandan.vn/phia-dong-dai-loan-trung-quoc-lai-hung-chiu-tran-dong-dat-manh-post715763.html
Nhật Bản kêu gọi gần 2 triệu người sơ tán để ứng phó siêu bão Nanmadol,https://nhandan.vn/nhat-ban-keu-goi-gan-2-trieu-nguoi-so-tan-de-ung-pho-sieu-bao-nanmadol-post715760.html
Thái Lan: Giao lưu thể thao văn hóa hữu nghị Việt Nam-Lào tại Khon Kaen,https://nhandan.vn/thai-lan-giao-luu-the-thao-van-hoa-huu-nghi-viet-nam-lao-tai-khon-kaen-post715754.html
Bộ Ngoại giao chỉ đạo bảo vệ quyền và lợi ích hợp pháp của công dân Việt Nam tại Campuchia,https://nhandan.vn/bo-ngoai-giao-chi-dao-bao-ve-quyen-va-loi-ich-hop-phap-cua-cong-dan-viet-nam-tai-campuchia-post715752.html
Canada khẳng định mối quan hệ đối tác với ASEAN ngày càng gắn kết,https://nhandan.vn/canada-khang-dinh-moi-quan-he-doi-tac-voi-asean-ngay-cang-gan-ket-post715747.html
"Va chạm máy bay tại Mỹ, 3 người thiệt mạng",https://nhandan.vn/va-cham-may-bay-tai-my-3-nguoi-thiet-mang-post715744.html
Nga đề nghị cung cấp lúa mỳ cho Pakistan để đối phó với lũ lụt,https://nhandan.vn/nga-de-nghi-cung-cap-lua-my-cho-pakistan-de-doi-pho-voi-lu-lut-post715739.html
"Khởi tố Phó Giám đốc Văn phòng đăng ký đất đai tỉnh Đồng Nai, Chi nhánh Long Thành",https://nhandan.vn/khoi-to-pho-giam-doc-van-phong-dang-ky-dat-dai-tinh-dong-nai-chi-nhanh-long-thanh-post715544.html
"Khởi tố, bắt tạm giam 3 cán bộ quản lý thị trường ở Bình Thuận",https://nhandan.vn/khoi-to-bat-tam-giam-3-can-bo-quan-ly-thi-truong-o-binh-thuan-post715539.html
"Thí điểm hỗ trợ, khuyến khích doanh nghiệp tự nguyện tuân thủ pháp luật hải quan",https://nhandan.vn/thi-diem-ho-tro-khuyen-khich-doanh-nghiep-tu-nguyen-tuan-thu-phap-luat-hai-quan-post715528.html
Đồng Tháp: Phát hiện nhóm sử dụng ma túy trong phòng hát,https://nhandan.vn/dong-thap-phat-hien-nhom-su-dung-ma-tuy-trong-phong-hat-post715511.html
Tạm đình chỉ hoạt động cơ sở karaoke Trump và Beer club Tiktok ở Cà Mau,https://nhandan.vn/tam-dinh-chi-hoat-dong-co-so-karaoke-trump-va-beer-club-tiktok-o-ca-mau-post715486.html
Xử lý nghiêm tình trạng xâm hại trẻ em,https://nhandan.vn/xu-ly-nghiem-tinh-trang-xam-hai-tre-em-post715441.html
Năm giải pháp giúp thúc đẩy thương mại giữa Việt Nam và Italy,https://nhandan.vn/nam-giai-phap-giup-thuc-day-thuong-mai-giua-viet-nam-va-italy-post715740.html
Kênh đào Suez sẽ tăng phí quá cảnh để đối phó với lạm phát,https://nhandan.vn/kenh-dao-suez-se-tang-phi-qua-canh-de-doi-pho-voi-lam-phat-post715738.html
Hàn Quốc và Trung Quốc tăng cường hợp tác vì hòa bình,https://nhandan.vn/han-quoc-va-trung-quoc-tang-cuong-hop-tac-vi-hoa-binh-post715728.html
Việt Nam và Bỉ giúp gắn kết ASEAN và EU,https://nhandan.vn/viet-nam-va-bi-giup-gan-ket-asean-va-eu-post715725.html
,https://nhandan.vn/giai-bong-da-bao-chi-thanh-pho-can-tho-gay-quy-vi-cong-dong-thanh-cong-tot-dep-post714128.html
,https://nhandan.vn/khoi-dong-giai-chay-gay-quy-cho-cac-cap-vo-chong-hiem-muon-post694934.html
,https://nhandan.vn/hon-760-trieu-dong-gay-quy-trong-cay-xanh-tu-giai-chay-cong-dong-post676201.html
Căn cước công dân sẽ thay thế nhiều loại giấy tờ,https://nhandan.vn/can-cuoc-cong-dan-se-thay-the-nhieu-loai-giay-to-post715437.html
,https://nhandan.vn/yen-bai-phat-trien-cay-tre-mang-bat-do-post632318.html
,https://nhandan.vn/cay-tre-than-lap-lanh-ve-dep-van-hoa-viet-post450660.html
Bộ trưởng Thông tin và Truyền thông kiểm tra chuyển đổi số tại Vĩnh Long,https://nhandan.vn/bo-truong-thong-tin-va-truyen-thong-kiem-tra-chuyen-doi-so-tai-vinh-long-post715573.html
Thúc đẩy hoạt động nghiên cứu của các nhà khoa học trẻ,https://nhandan.vn/thuc-day-hoat-dong-nghien-cuu-cua-cac-nha-khoa-hoc-tre-post715593.html
,https://nhandan.vn/phi-hanh-gia-trung-quoc-hoan-thanh-chuyen-di-bo-ngoai-khong-gian-post713443.html
,https://nhandan.vn/trung-quoc-phong-tau-than-chau-14-dua-3-phi-hanh-gia-vao-vu-tru-post700081.html
Bộ trưởng Thông tin và Truyền thông kiểm tra chuyển đổi số tại Vĩnh Long,https://nhandan.vn/bo-truong-thong-tin-va-truyen-thong-kiem-tra-chuyen-doi-so-tai-vinh-long-post715573.html
Thúc đẩy hoạt động nghiên cứu của các nhà khoa học trẻ,https://nhandan.vn/thuc-day-hoat-dong-nghien-cuu-cua-cac-nha-khoa-hoc-tre-post715593.html
"Trả lại gần 2,4 tỷ đồng hành khách quên trên máy bay",https://nhandan.vn/tra-lai-gan-24-ty-dong-hanh-khach-quen-tren-may-bay-post715493.html
Tìm thân nhân liệt sĩ qua các di vật,https://nhandan.vn/tim-than-nhan-liet-si-qua-cac-di-vat-post715620.html
"Đối thoại với doanh nghiệp ở Thành phố Hồ Chí Minh về bảo hiểm xã hội, bảo hiểm y tế",https://nhandan.vn/doi-thoai-voi-doanh-nghiep-o-thanh-pho-ho-chi-minh-ve-bao-hiem-xa-hoi-bao-hiem-y-te-post715567.html
Thêm 2 người chết trong vụ sập tường ở Bình Định,https://nhandan.vn/them-2-nguoi-chet-trong-vu-sap-tuong-o-binh-dinh-post715499.html
[Ảnh] Ùn ứ giao thông tại làn xe công nghệ sân bay Tân Sơn Nhất,https://nhandan.vn/anh-un-u-giao-thong-tai-lan-xe-cong-nghe-san-bay-tan-son-nhat-post715801.html
Nỗ lực tìm kiếm thuyền viên mất tích do chìm tàu trên vùng biển Cát Bà,https://nhandan.vn/no-luc-tim-kiem-thuyen-vien-mat-tich-do-chim-tau-tren-vung-bien-cat-ba-post715781.html
"Thành phố Hồ Chí Minh: Người già, người khuyết tật ở Thủ Đức nhận vé đi xe buýt miễn phí",https://nhandan.vn/thanh-pho-ho-chi-minh-nguoi-gia-nguoi-khuyet-tat-o-thu-duc-nhan-ve-di-xe-buyt-mien-phi-post715766.html
Xây dựng vườn cây thuốc quốc gia tại các vùng sinh thái,https://nhandan.vn/xay-dung-vuon-cay-thuoc-quoc-gia-tai-cac-vung-sinh-thai-post715608.html
Phi hành đoàn Trung Quốc 2 lần đi bộ ngoài không gian trong nửa tháng,https://nhandan.vn/phi-hanh-doan-trung-quoc-2-lan-di-bo-ngoai-khong-gian-trong-nua-thang-post715700.html
[Ảnh] Chủ tịch nước tiếp một số nhà khoa học quốc tế,https://nhandan.vn/anh-chu-tich-nuoc-tiep-mot-so-nha-khoa-hoc-quoc-te-post715585.html
Xây dựng vườn cây thuốc quốc gia tại các vùng sinh thái,https://nhandan.vn/xay-dung-vuon-cay-thuoc-quoc-gia-tai-cac-vung-sinh-thai-post715608.html
Phi hành đoàn Trung Quốc 2 lần đi bộ ngoài không gian trong nửa tháng,https://nhandan.vn/phi-hanh-doan-trung-quoc-2-lan-di-bo-ngoai-khong-gian-trong-nua-thang-post715700.html
[Ảnh] Chủ tịch nước tiếp một số nhà khoa học quốc tế,https://nhandan.vn/anh-chu-tich-nuoc-tiep-mot-so-nha-khoa-hoc-quoc-te-post715585.html
Hội thảo thế giới về tre tại Bình Dương,https://nhandan.vn/hoi-thao-the-gioi-ve-tre-tai-binh-duong-post715690.html
"Nâng cao chất lượng xét nghiệm, kỹ thuật chẩn đoán hình ảnh 4.0 trong chẩn đoán, điều trị bệnh",https://nhandan.vn/nang-cao-chat-luong-xet-nghiem-ky-thuat-chan-doan-hinh-anh-40-trong-chan-doan-dieu-tri-benh-post715667.html
Tunisia ra sắc lệnh trừng phạt hành vi tung tin giả,https://nhandan.vn/tunisia-ra-sac-lenh-trung-phat-hanh-vi-tung-tin-gia-post715645.html
Phát triển nhân lực số để chuyển đổi số hiệu quả,https://nhandan.vn/phat-trien-nhan-luc-so-de-chuyen-doi-so-hieu-qua-post715618.html
Xây dựng vườn cây thuốc quốc gia tại các vùng sinh thái,https://nhandan.vn/xay-dung-vuon-cay-thuoc-quoc-gia-tai-cac-vung-sinh-thai-post715608.html
"Bình Thuận: Tai nạn giao thông làm 2 người chết, 1 người bị thương nặng",https://nhandan.vn/binh-thuan-tai-nan-giao-thong-lam-2-nguoi-chet-1-nguoi-bi-thuong-nang-post715765.html
"Sương mù bao trùm Hà Nội, mức độ ô nhiễm không khí cao",https://nhandan.vn/suong-mu-bao-trum-ha-noi-muc-do-o-nhiem-khong-khi-cao-post715743.html
"Hỗ trợ sửa nhà, trao sinh kế cho thanh niên tôn giáo Đà Nẵng",https://nhandan.vn/ho-tro-sua-nha-trao-sinh-ke-cho-thanh-nien-ton-giao-da-nang-post715746.html
Thành lập Tổ công tác điều tra vụ sập tường tại Khu công nghiệp Nhơn Hòa,https://nhandan.vn/thanh-lap-to-cong-tac-dieu-tra-vu-sap-tuong-tai-khu-cong-nghiep-nhon-hoa-post715736.html
Tiếng vó ngựa triền đê,https://nhandan.vn/tieng-vo-ngua-trien-de-post715719.html
Giảm nghèo bền vững cho vùng đồng bào dân tộc thiểu số,https://nhandan.vn/giam-ngheo-ben-vung-cho-vung-dong-bao-dan-toc-thieu-so-post715717.html
"Khắc phục hậu quả mưa, lũ tại các tỉnh miền núi phía bắc",https://nhandan.vn/khac-phuc-hau-qua-mua-lu-tai-cac-tinh-mien-nui-phia-bac-post715711.html
Quảng Ngãi: Vốn tín dụng ưu đãi giúp hơn 185 nghìn hộ vượt nghèo,https://nhandan.vn/quang-ngai-von-tin-dung-uu-dai-giup-hon-185-nghin-ho-vuot-ngheo-post715678.html
,https://nhandan.vn/asean-dong-gop-vao-cac-no-luc-chung-bao-dam-an-ninh-an-toan-hat-nhan-post708520.html
,https://nhandan.vn/chu-tich-nuoc-nguyen-xuan-phuc-tiep-thong-doc-tinh-gunma-nhat-ban-post708761.html
,https://nhandan.vn/an-do-danh-gia-cao-vai-tro-cua-viet-nam-post710637.html
,https://nhandan.vn/quan-chuc-ngoai-giao-canada-danh-gia-viet-nam-chuyen-minh-an-tuong-post712501.html
,https://nhandan.vn/quan-he-viet-nam-nhat-ban-phat-trien-manh-me-toan-dien-va-thuc-chat-post715216.html
,https://nhandan.vn/giai-cuu-hon-600-cong-dan-bi-lua-tai-campuchia-post713387.html
,https://nhandan.vn/tiep-nhan-lao-dong-viet-nam-tro-ve-tu-campuchia-post713322.html
,https://nhandan.vn/tam-giu-hinh-su-2-doi-tuong-lien-quan-vu-40-nguoi-tron-tu-campuchia-ve-viet-nam-post711405.html
Không có người thương vong trong vụ cháy tòa nhà cao tầng ở Trung Quốc,https://nhandan.vn/khong-co-nguoi-thuong-vong-trong-vu-chay-toa-nha-cao-tang-o-trung-quoc-post715545.html
Kazakhstan giới hạn nhiệm kỳ tổng thống và sử dụng lại tên gọi cũ của thủ đô,https://nhandan.vn/kazakhstan-gioi-han-nhiem-ky-tong-thong-va-su-dung-lai-ten-goi-cu-cua-thu-do-post715702.html
Phi hành đoàn Trung Quốc 2 lần đi bộ ngoài không gian trong nửa tháng,https://nhandan.vn/phi-hanh-doan-trung-quoc-2-lan-di-bo-ngoai-khong-gian-trong-nua-thang-post715700.html
"Nâng cao chất lượng xét nghiệm, kỹ thuật chẩn đoán hình ảnh 4.0 trong chẩn đoán, điều trị bệnh",https://nhandan.vn/nang-cao-chat-luong-xet-nghiem-ky-thuat-chan-doan-hinh-anh-40-trong-chan-doan-dieu-tri-benh-post715667.html
Tunisia ra sắc lệnh trừng phạt hành vi tung tin giả,https://nhandan.vn/tunisia-ra-sac-lenh-trung-phat-hanh-vi-tung-tin-gia-post715645.html
Phát triển nhân lực số để chuyển đổi số hiệu quả,https://nhandan.vn/phat-trien-nhan-luc-so-de-chuyen-doi-so-hieu-qua-post715618.html
Xây dựng vườn cây thuốc quốc gia tại các vùng sinh thái,https://nhandan.vn/xay-dung-vuon-cay-thuoc-quoc-gia-tai-cac-vung-sinh-thai-post715608.html
Thúc đẩy hoạt động nghiên cứu của các nhà khoa học trẻ,https://nhandan.vn/thuc-day-hoat-dong-nghien-cuu-cua-cac-nha-khoa-hoc-tre-post715593.html
Sử dụng mạng xã hội để xây dựng thương hiệu cá nhân,https://nhandan.vn/su-dung-mang-xa-hoi-de-xay-dung-thuong-hieu-ca-nhan-post715581.html
[Ảnh] Chủ tịch nước tiếp một số nhà khoa học quốc tế,https://nhandan.vn/anh-chu-tich-nuoc-tiep-mot-so-nha-khoa-hoc-quoc-te-post715585.html
Bộ trưởng Thông tin và Truyền thông kiểm tra chuyển đổi số tại Vĩnh Long,https://nhandan.vn/bo-truong-thong-tin-va-truyen-thong-kiem-tra-chuyen-doi-so-tai-vinh-long-post715573.html
,https://nhandan.vn/ung-dung-tri-tue-nhan-tao-trong-chan-doan-hinh-anh-y-khoa-post711618.html
,https://nhandan.vn/bo-y-te-ban-hanh-huong-dan-chan-doan-dieu-tri-va-phong-benh-dau-mua-khi-o-nguoi-post707982.html
,https://nhandan.vn/hop-nghiem-thu-huong-dan-chan-doan-dieu-tri-benh-dau-mua-khi-post707441.html
,https://nhandan.vn/cac-xet-nghiem-de-chan-doan-mac-cum-a-post706696.html
,https://nhandan.vn/cac-cau-thu-trong-tai-chuyen-nghiep-deu-duoc-bao-hiem-post686207.html
,https://nhandan.vn/vff-va-vpf-can-som-quyet-dinh-so-phan-cac-giai-bong-da-chuyen-nghiep-post612060.html
Huyền thoại quần vợt Roger Federer tuyên bố giải nghệ,https://nhandan.vn/huyen-thoai-quan-vot-roger-federer-tuyen-bo-giai-nghe-post715424.html
"Thắng Mozambique 3-1, tuyển futsal Việt Nam xếp hạng 5 chung cuộc",https://nhandan.vn/thang-mozambique-3-1-tuyen-futsal-viet-nam-xep-hang-5-chung-cuoc-post715510.html
Phú Yên khai mạc Đại hội thể dục thể thao lần thứ 8 năm 2022,https://nhandan.vn/phu-yen-khai-mac-dai-hoi-the-duc-the-thao-lan-thu-8-nam-2022-post715662.html
"Thắng Timor-Leste 4-0, U20 Việt Nam duy trì lợi thế trước trận quyết định với U20 Indonesia",https://nhandan.vn/thang-timor-leste-4-0-u20-viet-nam-duy-tri-loi-the-truoc-tran-quyet-dinh-voi-u20-indonesia-post715579.html
,https://nhandan.vn/thang-nguoc-dong-villa-man-city-dang-quang-ngoai-hang-anh-post698325.html
,https://nhandan.vn/lua-thu-vang-voi-erling-haaland-post708275.html
,https://nhandan.vn/erling-braut-haaland-ga-khong-lo-bao-tron-troi-au-post640771.html
,https://nhandan.vn/khong-co-gioi-han-cho-sieu-nhan-erling-haaland-post635842.html
,https://nhandan.vn/erling-haaland-tiep-tuc-lam-mua-lam-gio-o-bundesliga-post579611.html
Huyền thoại quần vợt Roger Federer tuyên bố giải nghệ,https://nhandan.vn/huyen-thoai-quan-vot-roger-federer-tuyen-bo-giai-nghe-post715424.html
"Thắng Mozambique 3-1, tuyển futsal Việt Nam xếp hạng 5 chung cuộc",https://nhandan.vn/thang-mozambique-3-1-tuyen-futsal-viet-nam-xep-hang-5-chung-cuoc-post715510.html
Thúc đẩy hoạt động nghiên cứu của các nhà khoa học trẻ,https://nhandan.vn/thuc-day-hoat-dong-nghien-cuu-cua-cac-nha-khoa-hoc-tre-post715593.html
Sử dụng mạng xã hội để xây dựng thương hiệu cá nhân,https://nhandan.vn/su-dung-mang-xa-hoi-de-xay-dung-thuong-hieu-ca-nhan-post715581.html
[Ảnh] Chủ tịch nước tiếp một số nhà khoa học quốc tế,https://nhandan.vn/anh-chu-tich-nuoc-tiep-mot-so-nha-khoa-hoc-quoc-te-post715585.html
Bộ trưởng Thông tin và Truyền thông kiểm tra chuyển đổi số tại Vĩnh Long,https://nhandan.vn/bo-truong-thong-tin-va-truyen-thong-kiem-tra-chuyen-doi-so-tai-vinh-long-post715573.html
"Việt Nam mong muốn nhận được sự hỗ trợ, hợp tác của cộng đồng quốc tế và các nhà khoa học",https://nhandan.vn/viet-nam-mong-muon-nhan-duoc-su-ho-tro-hop-tac-cua-cong-dong-quoc-te-va-cac-nha-khoa-hoc-post715574.html
Tấn công mạng khiến các hệ thống nội bộ của Uber tê liệt,https://nhandan.vn/tan-cong-mang-khien-cac-he-thong-noi-bo-cua-uber-te-liet-post715515.html
"Bạc Liêu đẩy mạnh sử dụng chữ ký số trong các cơ quan, đơn vị",https://nhandan.vn/bac-lieu-day-manh-su-dung-chu-ky-so-trong-cac-co-quan-don-vi-post715362.html
Nhiều mẫu xe nổi bật sẽ được giới thiệu tại triển lãm ô-tô Việt Nam 2022,https://nhandan.vn/nhieu-mau-xe-noi-bat-se-duoc-gioi-thieu-tai-trien-lam-o-to-viet-nam-2022-post715286.html
Quảng Ngãi yêu cầu 100% cơ sở kinh doanh dịch vụ karaoke phải có lối thoát nạn thứ hai,https://nhandan.vn/quang-ngai-yeu-cau-100-co-so-kinh-doanh-dich-vu-karaoke-phai-co-loi-thoat-nan-thu-hai-post715670.html
Quảng Bình: 3 bà cháu ngồi trên vỉa hè bị xe ba gác tông thương vong,https://nhandan.vn/quang-binh-3-ba-chau-ngoi-tren-via-he-bi-xe-ba-gac-tong-thuong-vong-post715674.html
"Thái Bình xử phạt hơn 1,3 tỷ đồng các xe chở quá tải trọng",https://nhandan.vn/thai-binh-xu-phat-hon-13-ty-dong-cac-xe-cho-qua-tai-trong-post715666.html
Thái Nguyên tăng cường quản lý giá cước vận tải hành khách,https://nhandan.vn/thai-nguyen-tang-cuong-quan-ly-gia-cuoc-van-tai-hanh-khach-post715665.html
"[Ảnh] Mưu sinh ở ""thủ phủ"" phế liệu nhựa ven đô Hà Nội",https://nhandan.vn/anh-muu-sinh-o-thu-phu-phe-lieu-nhua-ven-do-ha-noi-post715540.html
,https://nhandan.vn/bang-tasmania-cua-australia-uu-tien-hop-tac-voi-cac-tinh-cua-viet-nam-post715625.html
Không có người thương vong trong vụ cháy tòa nhà cao tầng ở Trung Quốc,https://nhandan.vn/khong-co-nguoi-thuong-vong-trong-vu-chay-toa-nha-cao-tang-o-trung-quoc-post715545.html
Kazakhstan giới hạn nhiệm kỳ tổng thống và sử dụng lại tên gọi cũ của thủ đô,https://nhandan.vn/kazakhstan-gioi-han-nhiem-ky-tong-thong-va-su-dung-lai-ten-goi-cu-cua-thu-do-post715702.html
"Thụy Sĩ ngừng trao đổi thông tin thuế, hủy quy định thị thực với Nga",https://nhandan.vn/thuy-si-ngung-trao-doi-thong-tin-thue-huy-quy-dinh-thi-thuc-voi-nga-post715630.html
Phía Đông Đài Loan (Trung Quốc) lại hứng chịu trận động đất mạnh,https://nhandan.vn/phia-dong-dai-loan-trung-quoc-lai-hung-chiu-tran-dong-dat-manh-post715763.html
Hơn 3.600 doanh nghiệp tham dự Hội chợ ASEAN-Trung Quốc,https://nhandan.vn/hon-3600-doanh-nghiep-tham-du-hoi-cho-asean-trung-quoc-post715509.html
"Thụy Sĩ ngừng trao đổi thông tin thuế, hủy quy định thị thực với Nga",https://nhandan.vn/thuy-si-ngung-trao-doi-thong-tin-thue-huy-quy-dinh-thi-thuc-voi-nga-post715630.html
Phía Đông Đài Loan (Trung Quốc) lại hứng chịu trận động đất mạnh,https://nhandan.vn/phia-dong-dai-loan-trung-quoc-lai-hung-chiu-tran-dong-dat-manh-post715763.html
Hơn 3.600 doanh nghiệp tham dự Hội chợ ASEAN-Trung Quốc,https://nhandan.vn/hon-3600-doanh-nghiep-tham-du-hoi-cho-asean-trung-quoc-post715509.html
Thúc đẩy quan hệ đối tác chiến lược Việt Nam-Đức đi vào chiều sâu,https://nhandan.vn/thuc-day-quan-he-doi-tac-chien-luoc-viet-nam-duc-di-vao-chieu-sau-post715799.html
Trung Quốc thu hoạch lớn từ sứ mệnh thám hiểm sao Hỏa đầu tiên,https://nhandan.vn/trung-quoc-thu-hoach-lon-tu-su-menh-tham-hiem-sao-hoa-dau-tien-post715798.html
Thái Lan cân nhắc đánh thuế khí thải carbon,https://nhandan.vn/thai-lan-can-nhac-danh-thue-khi-thai-carbon-post715797.html
Thiệt hại ban đầu sau trận động đất tại Đài Loan (Trung Quốc),https://nhandan.vn/thiet-hai-ban-dau-sau-tran-dong-dat-tai-dai-loan-trung-quoc-post715796.html
"Việt Nam mong muốn nhận được sự hỗ trợ, hợp tác của cộng đồng quốc tế và các nhà khoa học",https://nhandan.vn/viet-nam-mong-muon-nhan-duoc-su-ho-tro-hop-tac-cua-cong-dong-quoc-te-va-cac-nha-khoa-hoc-post715574.html
Tấn công mạng khiến các hệ thống nội bộ của Uber tê liệt,https://nhandan.vn/tan-cong-mang-khien-cac-he-thong-noi-bo-cua-uber-te-liet-post715515.html
"Bạc Liêu đẩy mạnh sử dụng chữ ký số trong các cơ quan, đơn vị",https://nhandan.vn/bac-lieu-day-manh-su-dung-chu-ky-so-trong-cac-co-quan-don-vi-post715362.html
Nhiều mẫu xe nổi bật sẽ được giới thiệu tại triển lãm ô-tô Việt Nam 2022,https://nhandan.vn/nhieu-mau-xe-noi-bat-se-duoc-gioi-thieu-tai-trien-lam-o-to-viet-nam-2022-post715286.html
Góp ý cho “quy hoạch” Thủ đô năm 2045 trên nền tảng công nghệ số,https://nhandan.vn/gop-y-cho-quy-hoach-thu-do-nam-2045-tren-nen-tang-cong-nghe-so-post715285.html
Chuyển đổi số hướng đến thay đổi cách làm,https://nhandan.vn/chuyen-doi-so-huong-den-thay-doi-cach-lam-post715205.html
Australia hỗ trợ công nghệ bảo quản rau quả sau thu hoạch chi phí thấp,https://nhandan.vn/australia-ho-tro-cong-nghe-bao-quan-rau-qua-sau-thu-hoach-chi-phi-thap-post715175.html
,https://nhandan.vn/soi-dong-dua-ngua-tho-tren-cao-nguyen-trang-bac-ha-post700990.html
,https://nhandan.vn/du-lich-he-voi-festival-cao-nguyen-trang-bac-ha-post699435.html
,https://nhandan.vn/du-lich-long-an-an-toan-than-thien-hap-dan-post714090.html
,https://nhandan.vn/25-nghin-luot-khach-du-lich-den-long-an-trong-ky-nghi-le-quoc-khanh-post713611.html
,https://nhandan.vn/du-khach-den-long-an-tang-hon-50-so-ngay-thuong-post695427.html
Móng Cái: Không còn là điểm du lịch quá xa xôi,https://nhandan.vn/mong-cai-khong-con-la-diem-du-lich-qua-xa-xoi-post715494.html
Quảng Bình thúc đẩy hợp tác phát triển du lịch hang động 2 nước Việt Nam-Lào,https://nhandan.vn/quang-binh-thuc-day-hop-tac-phat-trien-du-lich-hang-dong-2-nuoc-viet-nam-lao-post715536.html
