name,link
Canada khẳng định mối quan hệ đối tác với ASEAN ngày càng gắn kết,https://nhandan.vn/canada-khang-dinh-moi-quan-he-doi-tac-voi-asean-ngay-cang-gan-ket-post715747.html
"20 năm góp phần cải thiện môi trường xanh, sạch, đẹp",https://nhandan.vn/20-nam-gop-phan-cai-thien-moi-truong-xanh-sach-dep-post715789.html
"35 doanh nghiệp chốt trả cổ tức, tuần từ 19 đến 23/9",https://nhandan.vn/35-doanh-nghiep-chot-tra-co-tuc-tuan-tu-19-den-239-post715779.html
Bảo đảm ổn định kinh tế vĩ mô như là yếu tố “bất biến’’ để ứng với “vạn biến’’ của tình hình kinh tế quốc tế,https://nhandan.vn/bao-dam-on-dinh-kinh-te-vi-mo-nhu-la-yeu-to-bat-bien-de-ung-voi-van-bien-cua-tinh-hinh-kinh-te-quoc-te-post715742.html
Khai mạc Diễn đàn Kinh tế-Xã hội Việt Nam 2022,https://nhandan.vn/khai-mac-dien-dan-kinh-te-xa-hoi-viet-nam-2022-post715737.html
"Sáng nay, khai mạc Diễn đàn Kinh tế-Xã hội Việt Nam 2022",https://nhandan.vn/sang-nay-khai-mac-dien-dan-kinh-te-xa-hoi-viet-nam-2022-post715705.html
Lựa chọn nhà thầu đủ năng lực làm đường cao tốc bắc-nam,https://nhandan.vn/lua-chon-nha-thau-du-nang-luc-lam-duong-cao-toc-bac-nam-post715713.html
Phú Yên: Gần 250 trẻ em mồ côi được nhận đỡ đầu đến 18 tuổi,https://nhandan.vn/phu-yen-gan-250-tre-em-mo-coi-duoc-nhan-do-dau-den-18-tuoi-post713815.html
Hơn 900 học sinh khó khăn nhận học bổng Lương Định Của,https://nhandan.vn/hon-900-hoc-sinh-kho-khan-nhan-hoc-bong-luong-dinh-cua-post712504.html
Người trưởng thôn được nhân dân tin quý,https://nhandan.vn/nguoi-truong-thon-duoc-nhan-dan-tin-quy-post712363.html
Tìm lại 100 triệu đồng để trả cho người đánh rơi,https://nhandan.vn/tim-lai-100-trieu-dong-de-tra-cho-nguoi-danh-roi-post711293.html
Công an Thanh Hóa đỡ đầu 2 trẻ mồ côi,https://nhandan.vn/cong-an-thanh-hoa-do-dau-2-tre-mo-coi-post710227.html
Lương y hết lòng tình nguyện vì cộng đồng,https://nhandan.vn/luong-y-het-long-tinh-nguyen-vi-cong-dong-post708923.html
Đại úy công an ở Đồng Tháp hy sinh khi làm nhiệm vụ,https://nhandan.vn/dai-uy-cong-an-o-dong-thap-hy-sinh-khi-lam-nhiem-vu-post708843.html
Biểu dương thiếu niên dũng cảm cứu người ở Nam Định,https://nhandan.vn/bieu-duong-thieu-nien-dung-cam-cuu-nguoi-o-nam-dinh-post708826.html
Trao trả hơn 100 triệu đồng cho người bị mất ở Thái Bình,https://nhandan.vn/trao-tra-hon-100-trieu-dong-cho-nguoi-bi-mat-o-thai-binh-post708671.html
25 đơn vị đủ điều kiện tổ chức thi đánh giá tiếng Anh theo khung 6 bậc,https://nhandan.vn/25-don-vi-du-dieu-kien-to-chuc-thi-danh-gia-tieng-anh-theo-khung-6-bac-post715634.html
"Điểm chuẩn Học viện An ninh nhân dân cao nhất là 25,66 điểm",https://nhandan.vn/diem-chuan-hoc-vien-an-ninh-nhan-dan-cao-nhat-la-2566-diem-post715631.html
Tạo thuận lợi cho công tác tuyển sinh,https://nhandan.vn/tao-thuan-loi-cho-cong-tac-tuyen-sinh-post715610.html
"Điểm trúng tuyển Học viện Khoa học quân sự cao nhất là 29,79",https://nhandan.vn/diem-trung-tuyen-hoc-vien-khoa-hoc-quan-su-cao-nhat-la-2979-post715621.html
Thúc đẩy hoạt động nghiên cứu của các nhà khoa học trẻ,https://nhandan.vn/thuc-day-hoat-dong-nghien-cuu-cua-cac-nha-khoa-hoc-tre-post715593.html
"Trao tặng phòng học, phòng nội trú cho học sinh huyện 30a Kỳ Sơn",https://nhandan.vn/trao-tang-phong-hoc-phong-noi-tru-cho-hoc-sinh-huyen-30a-ky-son-post715589.html
Nghệ An: Ưu tiên tối đa chỉ tiêu biên chế được bổ sung để tuyển dụng giáo viên mầm non,https://nhandan.vn/nghe-an-uu-tien-toi-da-chi-tieu-bien-che-duoc-bo-sung-de-tuyen-dung-giao-vien-mam-non-post715556.html
Vì sao điểm chuẩn “đụng trần”?,https://nhandan.vn/vi-sao-diem-chuan-dung-tran-post715550.html
Phi hành đoàn Trung Quốc 2 lần đi bộ ngoài không gian trong nửa tháng,https://nhandan.vn/phi-hanh-doan-trung-quoc-2-lan-di-bo-ngoai-khong-gian-trong-nua-thang-post715700.html
Kazakhstan giới hạn nhiệm kỳ tổng thống và sử dụng lại tên gọi cũ của thủ đô,https://nhandan.vn/kazakhstan-gioi-han-nhiem-ky-tong-thong-va-su-dung-lai-ten-goi-cu-cua-thu-do-post715702.html
"Nhiều tòa nhà tại Đài Loan (Trung Quốc) rung lắc do động đất với cường độ 6,4",https://nhandan.vn/nhieu-toa-nha-tai-dai-loan-trung-quoc-rung-lac-do-dong-dat-voi-cuong-do-64-post715699.html
"Nhật Bản, Hàn Quốc sẵn sàng ứng phó với siêu bão Nanmadol",https://nhandan.vn/nhat-ban-han-quoc-san-sang-ung-pho-voi-sieu-bao-nanmadol-post715683.html
"Xây dựng đường biên giới Việt-Trung hòa bình, hữu nghị, hợp tác",https://nhandan.vn/xay-dung-duong-bien-gioi-viet-trung-hoa-binh-huu-nghi-hop-tac-post715626.html
Bang Tasmania của Australia ưu tiên hợp tác với các tỉnh của Việt Nam,https://nhandan.vn/bang-tasmania-cua-australia-uu-tien-hop-tac-voi-cac-tinh-cua-viet-nam-post715625.html
Trung Quốc đại lục ghi nhận trường hợp đầu tiên mắc bệnh đậu mùa khỉ,https://nhandan.vn/trung-quoc-dai-luc-ghi-nhan-truong-hop-dau-tien-mac-benh-dau-mua-khi-post715603.html
Pakistan đối mặt nguy cơ dịch bệnh lây lan sau đợt lũ lụt nghiêm trọng,https://nhandan.vn/pakistan-doi-mat-nguy-co-dich-benh-lay-lan-sau-dot-lu-lut-nghiem-trong-post715570.html
"Bình Thuận: Tai nạn giao thông làm 2 người chết, 1 người bị thương nặng",https://nhandan.vn/binh-thuan-tai-nan-giao-thong-lam-2-nguoi-chet-1-nguoi-bi-thuong-nang-post715765.html
"Sương mù bao trùm Hà Nội, mức độ ô nhiễm không khí cao",https://nhandan.vn/suong-mu-bao-trum-ha-noi-muc-do-o-nhiem-khong-khi-cao-post715743.html
"Hỗ trợ sửa nhà, trao sinh kế cho thanh niên tôn giáo Đà Nẵng",https://nhandan.vn/ho-tro-sua-nha-trao-sinh-ke-cho-thanh-nien-ton-giao-da-nang-post715746.html
Thành lập Tổ công tác điều tra vụ sập tường tại Khu công nghiệp Nhơn Hòa,https://nhandan.vn/thanh-lap-to-cong-tac-dieu-tra-vu-sap-tuong-tai-khu-cong-nghiep-nhon-hoa-post715736.html
Tiếng vó ngựa triền đê,https://nhandan.vn/tieng-vo-ngua-trien-de-post715719.html
Giảm nghèo bền vững cho vùng đồng bào dân tộc thiểu số,https://nhandan.vn/giam-ngheo-ben-vung-cho-vung-dong-bao-dan-toc-thieu-so-post715717.html
"Khắc phục hậu quả mưa, lũ tại các tỉnh miền núi phía bắc",https://nhandan.vn/khac-phuc-hau-qua-mua-lu-tai-cac-tinh-mien-nui-phia-bac-post715711.html
Quảng Ngãi: Vốn tín dụng ưu đãi giúp hơn 185 nghìn hộ vượt nghèo,https://nhandan.vn/quang-ngai-von-tin-dung-uu-dai-giup-hon-185-nghin-ho-vuot-ngheo-post715678.html
Quảng Ngãi yêu cầu 100% cơ sở kinh doanh dịch vụ karaoke phải có lối thoát nạn thứ hai,https://nhandan.vn/quang-ngai-yeu-cau-100-co-so-kinh-doanh-dich-vu-karaoke-phai-co-loi-thoat-nan-thu-hai-post715670.html
Quảng Bình: 3 bà cháu ngồi trên vỉa hè bị xe ba gác tông thương vong,https://nhandan.vn/quang-binh-3-ba-chau-ngoi-tren-via-he-bi-xe-ba-gac-tong-thuong-vong-post715674.html
"Thái Bình xử phạt hơn 1,3 tỷ đồng các xe chở quá tải trọng",https://nhandan.vn/thai-binh-xu-phat-hon-13-ty-dong-cac-xe-cho-qua-tai-trong-post715666.html
Cảnh báo thời tiết nguy hiểm trên nhiều vùng biển,https://nhandan.vn/canh-bao-thoi-tiet-nguy-hiem-tren-nhieu-vung-bien-post715733.html
"Nam Trung Bộ, Tây Nguyên và Nam Bộ mưa dông kéo dài",https://nhandan.vn/nam-trung-bo-tay-nguyen-va-nam-bo-mua-dong-keo-dai-post715732.html
Kiểm soát các nguồn thải gây ô nhiễm môi trường,https://nhandan.vn/kiem-soat-cac-nguon-thai-gay-o-nhiem-moi-truong-post715714.html
Hội thảo thế giới về tre tại Bình Dương,https://nhandan.vn/hoi-thao-the-gioi-ve-tre-tai-binh-duong-post715690.html
"Nhật Bản, Hàn Quốc sẵn sàng ứng phó với siêu bão Nanmadol",https://nhandan.vn/nhat-ban-han-quoc-san-sang-ung-pho-voi-sieu-bao-nanmadol-post715683.html
"Cảnh báo lũ trên các sông suối ở khu vực Tây Bắc, Việt Bắc",https://nhandan.vn/canh-bao-lu-tren-cac-song-suoi-o-khu-vuc-tay-bac-viet-bac-post715637.html
Kè biển Cẩm Nhượng “kêu cứu”,https://nhandan.vn/ke-bien-cam-nhuong-keu-cuu-post715566.html
Bảo đảm an toàn vùng hạ du khi xả lũ,https://nhandan.vn/bao-dam-an-toan-vung-ha-du-khi-xa-lu-post715278.html
Phi hành đoàn Trung Quốc 2 lần đi bộ ngoài không gian trong nửa tháng,https://nhandan.vn/phi-hanh-doan-trung-quoc-2-lan-di-bo-ngoai-khong-gian-trong-nua-thang-post715700.html
Kazakhstan giới hạn nhiệm kỳ tổng thống và sử dụng lại tên gọi cũ của thủ đô,https://nhandan.vn/kazakhstan-gioi-han-nhiem-ky-tong-thong-va-su-dung-lai-ten-goi-cu-cua-thu-do-post715702.html
"Nhiều tòa nhà tại Đài Loan (Trung Quốc) rung lắc do động đất với cường độ 6,4",https://nhandan.vn/nhieu-toa-nha-tai-dai-loan-trung-quoc-rung-lac-do-dong-dat-voi-cuong-do-64-post715699.html
"Nhật Bản, Hàn Quốc sẵn sàng ứng phó với siêu bão Nanmadol",https://nhandan.vn/nhat-ban-han-quoc-san-sang-ung-pho-voi-sieu-bao-nanmadol-post715683.html
"Xây dựng đường biên giới Việt-Trung hòa bình, hữu nghị, hợp tác",https://nhandan.vn/xay-dung-duong-bien-gioi-viet-trung-hoa-binh-huu-nghi-hop-tac-post715626.html
Bang Tasmania của Australia ưu tiên hợp tác với các tỉnh của Việt Nam,https://nhandan.vn/bang-tasmania-cua-australia-uu-tien-hop-tac-voi-cac-tinh-cua-viet-nam-post715625.html
Trung Quốc đại lục ghi nhận trường hợp đầu tiên mắc bệnh đậu mùa khỉ,https://nhandan.vn/trung-quoc-dai-luc-ghi-nhan-truong-hop-dau-tien-mac-benh-dau-mua-khi-post715603.html
Pakistan đối mặt nguy cơ dịch bệnh lây lan sau đợt lũ lụt nghiêm trọng,https://nhandan.vn/pakistan-doi-mat-nguy-co-dich-benh-lay-lan-sau-dot-lu-lut-nghiem-trong-post715570.html
Không có người thương vong trong vụ cháy tòa nhà cao tầng ở Trung Quốc,https://nhandan.vn/khong-co-nguoi-thuong-vong-trong-vu-chay-toa-nha-cao-tang-o-trung-quoc-post715545.html
Căn cước công dân sẽ thay thế nhiều loại giấy tờ,https://nhandan.vn/can-cuoc-cong-dan-se-thay-the-nhieu-loai-giay-to-post715437.html
"Trả lại gần 2,4 tỷ đồng hành khách quên trên máy bay",https://nhandan.vn/tra-lai-gan-24-ty-dong-hanh-khach-quen-tren-may-bay-post715493.html
Tìm thân nhân liệt sĩ qua các di vật,https://nhandan.vn/tim-than-nhan-liet-si-qua-cac-di-vat-post715620.html
"Đối thoại với doanh nghiệp ở Thành phố Hồ Chí Minh về bảo hiểm xã hội, bảo hiểm y tế",https://nhandan.vn/doi-thoai-voi-doanh-nghiep-o-thanh-pho-ho-chi-minh-ve-bao-hiem-xa-hoi-bao-hiem-y-te-post715567.html
Thêm 2 người chết trong vụ sập tường ở Bình Định,https://nhandan.vn/them-2-nguoi-chet-trong-vu-sap-tuong-o-binh-dinh-post715499.html
[Ảnh] Ùn ứ giao thông tại làn xe công nghệ sân bay Tân Sơn Nhất,https://nhandan.vn/anh-un-u-giao-thong-tai-lan-xe-cong-nghe-san-bay-tan-son-nhat-post715801.html
Nỗ lực tìm kiếm thuyền viên mất tích do chìm tàu trên vùng biển Cát Bà,https://nhandan.vn/no-luc-tim-kiem-thuyen-vien-mat-tich-do-chim-tau-tren-vung-bien-cat-ba-post715781.html
"Va chạm máy bay tại Mỹ, 3 người thiệt mạng",https://nhandan.vn/va-cham-may-bay-tai-my-3-nguoi-thiet-mang-post715744.html
Nga đề nghị cung cấp lúa mỳ cho Pakistan để đối phó với lũ lụt,https://nhandan.vn/nga-de-nghi-cung-cap-lua-my-cho-pakistan-de-doi-pho-voi-lu-lut-post715739.html
Năm giải pháp giúp thúc đẩy thương mại giữa Việt Nam và Italy,https://nhandan.vn/nam-giai-phap-giup-thuc-day-thuong-mai-giua-viet-nam-va-italy-post715740.html
Kênh đào Suez sẽ tăng phí quá cảnh để đối phó với lạm phát,https://nhandan.vn/kenh-dao-suez-se-tang-phi-qua-canh-de-doi-pho-voi-lam-phat-post715738.html
Hàn Quốc và Trung Quốc tăng cường hợp tác vì hòa bình,https://nhandan.vn/han-quoc-va-trung-quoc-tang-cuong-hop-tac-vi-hoa-binh-post715728.html
Việt Nam và Bỉ giúp gắn kết ASEAN và EU,https://nhandan.vn/viet-nam-va-bi-giup-gan-ket-asean-va-eu-post715725.html
Châu Âu nỗ lực bảo đảm an ninh lương thực và năng lượng,https://nhandan.vn/chau-au-no-luc-bao-dam-an-ninh-luong-thuc-va-nang-luong-post715726.html
"Quy định mới về chào bán, giao dịch trái phiếu doanh nghiệp",https://nhandan.vn/quy-dinh-moi-ve-chao-ban-giao-dich-trai-phieu-doanh-nghiep-post715696.html
Chuyến hàng sầu riêng đầu tiên ở Đắk Lắk xuất khẩu chính ngạch sang Trung Quốc,https://nhandan.vn/chuyen-hang-sau-rieng-dau-tien-o-dak-lak-xuat-khau-chinh-ngach-sang-trung-quoc-post715691.html
Tạo chuỗi cung ứng nguyên liệu gỗ bền vững,https://nhandan.vn/tao-chuoi-cung-ung-nguyen-lieu-go-ben-vung-post715689.html
Cà Mau cầu cứu nguồn cung xăng dầu,https://nhandan.vn/ca-mau-cau-cuu-nguon-cung-xang-dau-post715688.html
"Các nhiệm vụ, giải pháp trọng tâm giữ vững ổn định kinh tế vĩ mô, kiểm soát lạm phát, thúc đẩy tăng trưởng",https://nhandan.vn/cac-nhiem-vu-giai-phap-trong-tam-giu-vung-on-dinh-kinh-te-vi-mo-kiem-soat-lam-phat-thuc-day-tang-truong-post715679.html
Hai công ty Chứng khoán Everest và Chứng khoán An Bình bị phạt hơn 700 triệu đồng,https://nhandan.vn/hai-cong-ty-chung-khoan-everest-va-chung-khoan-an-binh-bi-phat-hon-700-trieu-dong-post715675.html
"Bến Tre có nhu cầu lớn về vốn phát triển nông nghiệp, nông thôn",https://nhandan.vn/ben-tre-co-nhu-cau-lon-ve-von-phat-trien-nong-nghiep-nong-thon-post715668.html
"Thay đổi thông tin, hủy đăng ký chứng khoán cho các công ty",https://nhandan.vn/thay-doi-thong-tin-huy-dang-ky-chung-khoan-cho-cac-cong-ty-post715638.html
Việt Nam luôn ưu tiên tạo điều kiện cho các nhà đầu tư nước ngoài,https://nhandan.vn/viet-nam-luon-uu-tien-tao-dieu-kien-cho-cac-nha-dau-tu-nuoc-ngoai-post715635.html
Tên các anh đã được khắc trong tim nhân dân cả nước,https://nhandan.vn/ten-cac-anh-da-duoc-khac-trong-tim-nhan-dan-ca-nuoc-post708428.html
Đề xuất truy tặng khen thưởng 3 cảnh sát chữa cháy hy sinh tại phường Quan Hoa,https://nhandan.vn/de-xuat-truy-tang-khen-thuong-3-canh-sat-chua-chay-hy-sinh-tai-phuong-quan-hoa-post708427.html
3 chiến sĩ Cảnh sát giải cứu 8 người dân trước khi hy sinh,https://nhandan.vn/3-chien-si-canh-sat-giai-cuu-8-nguoi-dan-truoc-khi-hy-sinh-post708363.html
Điểm chuẩn và số lượng trúng tuyển Trường Đại học Y Hà Nội,https://nhandan.vn/diem-chuan-va-so-luong-trung-tuyen-truong-dai-hoc-y-ha-noi-post715538.html
Trường Đại học Kinh tế quốc dân liên kết đào tạo ngành tài chính và quản lý,https://nhandan.vn/truong-dai-hoc-kinh-te-quoc-dan-lien-ket-dao-tao-nganh-tai-chinh-va-quan-ly-post715527.html
Thái Nguyên tăng cường quản lý giá cước vận tải hành khách,https://nhandan.vn/thai-nguyen-tang-cuong-quan-ly-gia-cuoc-van-tai-hanh-khach-post715665.html
Gần 63 nghìn người chạy bộ gây quỹ hỗ trợ đồng bào dân tộc thiểu số,https://nhandan.vn/gan-63-nghin-nguoi-chay-bo-gay-quy-ho-tro-dong-bao-dan-toc-thieu-so-post715663.html
"Ngày 17/9, nhiều khu vực trên cả nước có mưa dông",https://nhandan.vn/ngay-179-nhieu-khu-vuc-tren-ca-nuoc-co-mua-dong-post715619.html
Hội đồng thẩm định thông qua quy hoạch về tài nguyên nước,https://nhandan.vn/hoi-dong-tham-dinh-thong-qua-quy-hoach-ve-tai-nguyen-nuoc-post715599.html
Pakistan đối mặt nguy cơ dịch bệnh lây lan sau đợt lũ lụt nghiêm trọng,https://nhandan.vn/pakistan-doi-mat-nguy-co-dich-benh-lay-lan-sau-dot-lu-lut-nghiem-trong-post715570.html
Bình Phước: Phát hiện nhiều tấn chất thải đổ ra môi trường,https://nhandan.vn/binh-phuoc-phat-hien-nhieu-tan-chat-thai-do-ra-moi-truong-post715559.html
"Thành phố Hồ Chí Minh: Người già, người khuyết tật ở Thủ Đức nhận vé đi xe buýt miễn phí",https://nhandan.vn/thanh-pho-ho-chi-minh-nguoi-gia-nguoi-khuyet-tat-o-thu-duc-nhan-ve-di-xe-buyt-mien-phi-post715766.html
"Bình Thuận: Tai nạn giao thông làm 2 người chết, 1 người bị thương nặng",https://nhandan.vn/binh-thuan-tai-nan-giao-thong-lam-2-nguoi-chet-1-nguoi-bi-thuong-nang-post715765.html
"Sương mù bao trùm Hà Nội, mức độ ô nhiễm không khí cao",https://nhandan.vn/suong-mu-bao-trum-ha-noi-muc-do-o-nhiem-khong-khi-cao-post715743.html
"Hỗ trợ sửa nhà, trao sinh kế cho thanh niên tôn giáo Đà Nẵng",https://nhandan.vn/ho-tro-sua-nha-trao-sinh-ke-cho-thanh-nien-ton-giao-da-nang-post715746.html
Thành lập Tổ công tác điều tra vụ sập tường tại Khu công nghiệp Nhơn Hòa,https://nhandan.vn/thanh-lap-to-cong-tac-dieu-tra-vu-sap-tuong-tai-khu-cong-nghiep-nhon-hoa-post715736.html
Tiếng vó ngựa triền đê,https://nhandan.vn/tieng-vo-ngua-trien-de-post715719.html
Giảm nghèo bền vững cho vùng đồng bào dân tộc thiểu số,https://nhandan.vn/giam-ngheo-ben-vung-cho-vung-dong-bao-dan-toc-thieu-so-post715717.html
"Khắc phục hậu quả mưa, lũ tại các tỉnh miền núi phía bắc",https://nhandan.vn/khac-phuc-hau-qua-mua-lu-tai-cac-tinh-mien-nui-phia-bac-post715711.html
Quảng Ngãi: Vốn tín dụng ưu đãi giúp hơn 185 nghìn hộ vượt nghèo,https://nhandan.vn/quang-ngai-von-tin-dung-uu-dai-giup-hon-185-nghin-ho-vuot-ngheo-post715678.html
Quảng Ngãi yêu cầu 100% cơ sở kinh doanh dịch vụ karaoke phải có lối thoát nạn thứ hai,https://nhandan.vn/quang-ngai-yeu-cau-100-co-so-kinh-doanh-dich-vu-karaoke-phai-co-loi-thoat-nan-thu-hai-post715670.html
Quảng Bình: 3 bà cháu ngồi trên vỉa hè bị xe ba gác tông thương vong,https://nhandan.vn/quang-binh-3-ba-chau-ngoi-tren-via-he-bi-xe-ba-gac-tong-thuong-vong-post715674.html
"Thái Bình xử phạt hơn 1,3 tỷ đồng các xe chở quá tải trọng",https://nhandan.vn/thai-binh-xu-phat-hon-13-ty-dong-cac-xe-cho-qua-tai-trong-post715666.html
Thái Nguyên tăng cường quản lý giá cước vận tải hành khách,https://nhandan.vn/thai-nguyen-tang-cuong-quan-ly-gia-cuoc-van-tai-hanh-khach-post715665.html
Gần 63 nghìn người chạy bộ gây quỹ hỗ trợ đồng bào dân tộc thiểu số,https://nhandan.vn/gan-63-nghin-nguoi-chay-bo-gay-quy-ho-tro-dong-bao-dan-toc-thieu-so-post715663.html
Tạo đột phá trong phát triển văn hóa (Tiếp theo và hết) (*),https://nhandan.vn/tao-dot-pha-trong-phat-trien-van-hoa-tiep-theo-va-het-post715440.html
Tạo đột phá trong phát triển văn hóa,https://nhandan.vn/tao-dot-pha-trong-phat-trien-van-hoa-post714937.html
Khai thác thế mạnh của mạng xã hội trong tuyên truyền chính trị,https://nhandan.vn/khai-thac-the-manh-cua-mang-xa-hoi-trong-tuyen-truyen-chinh-tri-post714387.html
Đánh giá đúng vai trò của kinh tế tập thể,https://nhandan.vn/danh-gia-dung-vai-tro-cua-kinh-te-tap-the-post713881.html
Cảnh giác để không bị lôi kéo vào các tổ chức bất hợp pháp,https://nhandan.vn/canh-giac-de-khong-bi-loi-keo-vao-cac-to-chuc-bat-hop-phap-post712829.html
Tạo đột phá trong phát triển văn hóa (Tiếp theo và hết) (*),https://nhandan.vn/tao-dot-pha-trong-phat-trien-van-hoa-tiep-theo-va-het-post715440.html
Tạo đột phá trong phát triển văn hóa,https://nhandan.vn/tao-dot-pha-trong-phat-trien-van-hoa-post714937.html
Khai thác thế mạnh của mạng xã hội trong tuyên truyền chính trị,https://nhandan.vn/khai-thac-the-manh-cua-mang-xa-hoi-trong-tuyen-truyen-chinh-tri-post714387.html
Đánh giá đúng vai trò của kinh tế tập thể,https://nhandan.vn/danh-gia-dung-vai-tro-cua-kinh-te-tap-the-post713881.html
Cảnh giác để không bị lôi kéo vào các tổ chức bất hợp pháp,https://nhandan.vn/canh-giac-de-khong-bi-loi-keo-vao-cac-to-chuc-bat-hop-phap-post712829.html
Trách nhiệm và bổn phận của người con đất Việt,https://nhandan.vn/trach-nhiem-va-bon-phan-cua-nguoi-con-dat-viet-post712258.html
Bảo vệ môi trường văn hóa lành mạnh,https://nhandan.vn/bao-ve-moi-truong-van-hoa-lanh-manh-post711691.html
Bảo đảm an ninh mạng là nhiệm vụ cấp bách,https://nhandan.vn/bao-dam-an-ninh-mang-la-nhiem-vu-cap-bach-post711122.html
"Bộ Chính trị, Ban Bí thư thi hành kỷ luật các tập thể, cá nhân tỉnh Hải Dương",https://nhandan.vn/bo-chinh-tri-ban-bi-thu-thi-hanh-ky-luat-cac-tap-the-ca-nhan-tinh-hai-duong-post715577.html
"Đồng Tháp: Điều động, bổ nhiệm nhiều cán bộ chủ chốt",https://nhandan.vn/dong-thap-dieu-dong-bo-nhiem-nhieu-can-bo-chu-chot-post715496.html
Việt Nam luôn ưu tiên tạo điều kiện cho các nhà đầu tư nước ngoài,https://nhandan.vn/viet-nam-luon-uu-tien-tao-dieu-kien-cho-cac-nha-dau-tu-nuoc-ngoai-post715635.html
Thắt chặt tình đoàn kết Việt Nam-Lào,https://nhandan.vn/that-chat-tinh-doan-ket-viet-nam-lao-post715414.html
Bộ trưởng Lê Minh Hoan thăm trường mang tên Bác tại Mông Cổ,https://nhandan.vn/bo-truong-le-minh-hoan-tham-truong-mang-ten-bac-tai-mong-co-post715427.html
"Không thể phủ nhận nỗ lực phòng, chống mua bán người của Việt Nam",https://nhandan.vn/khong-the-phu-nhan-no-luc-phong-chong-mua-ban-nguoi-cua-viet-nam-post710642.html
Kiểm soát văn hóa phẩm thời kỳ công nghệ số: Vấn đề cấp bách,https://nhandan.vn/kiem-soat-van-hoa-pham-thoi-ky-cong-nghe-so-van-de-cap-bach-post710065.html
Kiểm soát văn hóa phẩm thời kỳ công nghệ số,https://nhandan.vn/kiem-soat-van-hoa-pham-thoi-ky-cong-nghe-so-post709505.html
"Lợi dụng vấn đề ngôn ngữ để chống phá, chia rẽ khối đại đoàn kết dân tộc",https://nhandan.vn/loi-dung-van-de-ngon-ngu-de-chong-pha-chia-re-khoi-dai-doan-ket-dan-toc-post708894.html
Tỉnh táo trước luận điệu xuyên tạc kinh tế thị trường định hướng xã hội chủ nghĩa,https://nhandan.vn/tinh-tao-truoc-luan-dieu-xuyen-tac-kinh-te-thi-truong-dinh-huong-xa-hoi-chu-nghia-post708401.html
"Bảo tồn, phát huy văn hóa các dân tộc thiểu số",https://nhandan.vn/bao-ton-phat-huy-van-hoa-cac-dan-toc-thieu-so-post707842.html
Quyền con người và sức khỏe cộng đồng,https://nhandan.vn/quyen-con-nguoi-va-suc-khoe-cong-dong-post707292.html
Giá trị tinh thần trong ngày tri ân,https://nhandan.vn/gia-tri-tinh-than-trong-ngay-tri-an-post706657.html
Tạo đột phá trong phát triển văn hóa (Tiếp theo và hết) (*),https://nhandan.vn/tao-dot-pha-trong-phat-trien-van-hoa-tiep-theo-va-het-post715440.html
Tạo đột phá trong phát triển văn hóa,https://nhandan.vn/tao-dot-pha-trong-phat-trien-van-hoa-post714937.html
Khai thác thế mạnh của mạng xã hội trong tuyên truyền chính trị,https://nhandan.vn/khai-thac-the-manh-cua-mang-xa-hoi-trong-tuyen-truyen-chinh-tri-post714387.html
Đánh giá đúng vai trò của kinh tế tập thể,https://nhandan.vn/danh-gia-dung-vai-tro-cua-kinh-te-tap-the-post713881.html
Cảnh giác để không bị lôi kéo vào các tổ chức bất hợp pháp,https://nhandan.vn/canh-giac-de-khong-bi-loi-keo-vao-cac-to-chuc-bat-hop-phap-post712829.html
Hậu Giang chuyển mạnh từ “chính quyền quản lý” sang “chính quyền phục vụ”,https://nhandan.vn/hau-giang-chuyen-manh-tu-chinh-quyen-quan-ly-sang-chinh-quyen-phuc-vu-post715756.html
Tăng nguồn lực hỗ trợ người nghèo,https://nhandan.vn/tang-nguon-luc-ho-tro-nguoi-ngheo-post715718.html
Kỷ niệm 55 năm Củ Chi được phong tặng danh hiệu “Đất thép thành đồng”,https://nhandan.vn/ky-niem-55-nam-cu-chi-duoc-phong-tang-danh-hieu-dat-thep-thanh-dong-post715672.html
"Phát huy tinh thần trách nhiệm, triển khai nhanh các công trình, dự án giao thông trọng điểm",https://nhandan.vn/phat-huy-tinh-than-trach-nhiem-trien-khai-nhanh-cac-cong-trinh-du-an-giao-thong-trong-diem-post715671.html
"Kỷ niệm 55 năm Long An “Trung dũng kiên cường, toàn dân đánh giặc”",https://nhandan.vn/ky-niem-55-nam-long-an-trung-dung-kien-cuong-toan-dan-danh-giac-post715651.html
[Ảnh] Thủ tướng Phạm Minh Chính chủ trì Hội nghị Thủ tướng Chính phủ với doanh nghiệp đầu tư nước ngoài,https://nhandan.vn/anh-thu-tuong-pham-minh-chinh-chu-tri-hoi-nghi-thu-tuong-chinh-phu-voi-doanh-nghiep-dau-tu-nuoc-ngoai-post715656.html
Chủ tịch Quốc hội kiểm tra công tác chuẩn bị tổ chức Diễn đàn Kinh tế-Xã hội Việt Nam 2022,https://nhandan.vn/chu-tich-quoc-hoi-kiem-tra-cong-tac-chuan-bi-to-chuc-dien-dan-kinh-te-xa-hoi-viet-nam-2022-post715654.html
Việt Nam luôn ưu tiên tạo điều kiện cho các nhà đầu tư nước ngoài,https://nhandan.vn/viet-nam-luon-uu-tien-tao-dieu-kien-cho-cac-nha-dau-tu-nuoc-ngoai-post715635.html
Tạo đột phá trong phát triển văn hóa (Tiếp theo và hết) (*),https://nhandan.vn/tao-dot-pha-trong-phat-trien-van-hoa-tiep-theo-va-het-post715440.html
Tạo đột phá trong phát triển văn hóa,https://nhandan.vn/tao-dot-pha-trong-phat-trien-van-hoa-post714937.html
