name,link
,https://nhandan.vn/anh-khai-mac-dien-dan-kinh-te-xa-hoi-viet-nam-2022-post715741.html
,https://nhandan.vn/khai-mac-dien-dan-kinh-te-xa-hoi-viet-nam-2022-post715737.html
,https://nhandan.vn/sang-nay-khai-mac-dien-dan-kinh-te-xa-hoi-viet-nam-2022-post715705.html
Công ty chứng khoán VPS bị phạt vì vi phạm trong giao dịch ký quỹ,https://nhandan.vn/cong-ty-chung-khoan-vps-bi-phat-vi-vi-pham-trong-giao-dich-ky-quy-post715565.html
"Quy định mới về chào bán, giao dịch trái phiếu doanh nghiệp",https://nhandan.vn/quy-dinh-moi-ve-chao-ban-giao-dich-trai-phieu-doanh-nghiep-post715696.html
"Bến Tre có nhu cầu lớn về vốn phát triển nông nghiệp, nông thôn",https://nhandan.vn/ben-tre-co-nhu-cau-lon-ve-von-phat-trien-nong-nghiep-nong-thon-post715668.html
Việt Nam luôn ưu tiên tạo điều kiện cho các nhà đầu tư nước ngoài,https://nhandan.vn/viet-nam-luon-uu-tien-tao-dieu-kien-cho-cac-nha-dau-tu-nuoc-ngoai-post715635.html
Chuyến hàng sầu riêng đầu tiên ở Đắk Lắk xuất khẩu chính ngạch sang Trung Quốc,https://nhandan.vn/chuyen-hang-sau-rieng-dau-tien-o-dak-lak-xuat-khau-chinh-ngach-sang-trung-quoc-post715691.html
Vận dụng linh hoạt hơn nữa chính sách tiền tệ,https://nhandan.vn/van-dung-linh-hoat-hon-nua-chinh-sach-tien-te-post715803.html
"20 năm góp phần cải thiện môi trường xanh, sạch, đẹp",https://nhandan.vn/20-nam-gop-phan-cai-thien-moi-truong-xanh-sach-dep-post715789.html
"Nâng cao năng lực chống chịu, tính tự cường của nền kinh tế",https://nhandan.vn/nang-cao-nang-luc-chong-chiu-tinh-tu-cuong-cua-nen-kinh-te-post715791.html
"35 doanh nghiệp chốt trả cổ tức, tuần từ 19 đến 23/9",https://nhandan.vn/35-doanh-nghiep-chot-tra-co-tuc-tuan-tu-19-den-239-post715779.html
Bộ trưởng Tài chính: Cần quản lý chặt chẽ mục đích sử dụng đất,https://nhandan.vn/bo-truong-tai-chinh-can-quan-ly-chat-che-muc-dich-su-dung-dat-post715761.html
Các chính sách hỗ trợ tạo động lực phục hồi kinh tế,https://nhandan.vn/cac-chinh-sach-ho-tro-tao-dong-luc-phuc-hoi-kinh-te-post715759.html
Đẩy mạnh cải cách thể chế - giải pháp quan trọng trong phục hồi và phát triển kinh tế-xã hội,https://nhandan.vn/day-manh-cai-cach-the-che-giai-phap-quan-trong-trong-phuc-hoi-va-phat-trien-kinh-te-xa-hoi-post715749.html
Bảo đảm ổn định kinh tế vĩ mô như là yếu tố “bất biến’’ để ứng với “vạn biến’’ của tình hình kinh tế quốc tế,https://nhandan.vn/bao-dam-on-dinh-kinh-te-vi-mo-nhu-la-yeu-to-bat-bien-de-ung-voi-van-bien-cua-tinh-hinh-kinh-te-quoc-te-post715742.html
,https://nhandan.vn/anh-doc-dao-mua-lan-choi-trung-thu-noi-ngoai-thanh-ha-noi-post714342.html
,https://nhandan.vn/pho-chu-tich-nuoc-vo-thi-anh-xuan-vui-tet-trung-thu-voi-hoc-sinh-yen-bai-post714366.html
,https://nhandan.vn/hau-giang-to-chuc-vui-tet-trung-thu-cho-cac-em-thieu-nien-nhi-dong-post714346.html
Lựa chọn nhà thầu đủ năng lực làm đường cao tốc bắc-nam,https://nhandan.vn/lua-chon-nha-thau-du-nang-luc-lam-duong-cao-toc-bac-nam-post715713.html
"Quy định mới về chào bán, giao dịch trái phiếu doanh nghiệp",https://nhandan.vn/quy-dinh-moi-ve-chao-ban-giao-dich-trai-phieu-doanh-nghiep-post715696.html
Chuyến hàng sầu riêng đầu tiên ở Đắk Lắk xuất khẩu chính ngạch sang Trung Quốc,https://nhandan.vn/chuyen-hang-sau-rieng-dau-tien-o-dak-lak-xuat-khau-chinh-ngach-sang-trung-quoc-post715691.html
Tạo chuỗi cung ứng nguyên liệu gỗ bền vững,https://nhandan.vn/tao-chuoi-cung-ung-nguyen-lieu-go-ben-vung-post715689.html
Cà Mau cầu cứu nguồn cung xăng dầu,https://nhandan.vn/ca-mau-cau-cuu-nguon-cung-xang-dau-post715688.html
"Các nhiệm vụ, giải pháp trọng tâm giữ vững ổn định kinh tế vĩ mô, kiểm soát lạm phát, thúc đẩy tăng trưởng",https://nhandan.vn/cac-nhiem-vu-giai-phap-trong-tam-giu-vung-on-dinh-kinh-te-vi-mo-kiem-soat-lam-phat-thuc-day-tang-truong-post715679.html
Hai công ty Chứng khoán Everest và Chứng khoán An Bình bị phạt hơn 700 triệu đồng,https://nhandan.vn/hai-cong-ty-chung-khoan-everest-va-chung-khoan-an-binh-bi-phat-hon-700-trieu-dong-post715675.html
,https://nhandan.vn/tet-trung-thu-dac-biet-cua-nhung-hoc-sinh-khuyet-tat-ha-noi-post714100.html
,https://nhandan.vn/doc-dao-le-hoi-trung-thu-tuyen-quang-post714262.html
[Ảnh] Tưng bừng lễ hội đua bò truyền thống của đồng bào Khmer,https://nhandan.vn/anh-tung-bung-le-hoi-dua-bo-truyen-thong-cua-dong-bao-khmer-post715800.html
Trao 5 giải A tại liên hoan hát Xẩm mở rộng năm 2022,https://nhandan.vn/trao-5-giai-a-tai-lien-hoan-hat-xam-mo-rong-nam-2022-post715757.html
Chương trình hòa nhạc “Giai điệu Tây Ban Nha” tại Hà Nội,https://nhandan.vn/chuong-trinh-hoa-nhac-giai-dieu-tay-ban-nha-tai-ha-noi-post715748.html
Món ăn kết hợp văn hóa Việt Nam-Hoa Kỳ giành giải Nhất cuộc thi “Sáng tạo hương vị mùa hè cùng việt quất Hoa Kỳ”,https://nhandan.vn/mon-an-ket-hop-van-hoa-viet-nam-hoa-ky-gianh-giai-nhat-cuoc-thi-sang-tao-huong-vi-mua-he-cung-viet-quat-hoa-ky-post715745.html
"Bến Tre có nhu cầu lớn về vốn phát triển nông nghiệp, nông thôn",https://nhandan.vn/ben-tre-co-nhu-cau-lon-ve-von-phat-trien-nong-nghiep-nong-thon-post715668.html
Sơn La vinh danh “Nghệ thuật xòe Thái”- di sản văn hóa phi vật thể đại diện của nhân loại,https://nhandan.vn/son-la-vinh-danh-nghe-thuat-xoe-thai-di-san-van-hoa-phi-vat-the-dai-dien-cua-nhan-loai-post715706.html
Đọc sách: “Khai nguyên rồng tiên”,https://nhandan.vn/doc-sach-khai-nguyen-rong-tien-post715676.html
Trao giải và triển lãm ảnh nghệ thuật “Huế - Những góc nhìn mới”,https://nhandan.vn/trao-giai-va-trien-lam-anh-nghe-thuat-hue-nhung-goc-nhin-moi-post715684.html
Thanh Hóa tổ chức Lễ hội Lam Kinh năm 2022,https://nhandan.vn/thanh-hoa-to-chuc-le-hoi-lam-kinh-nam-2022-post715680.html
Liên hoan hát Xẩm mở rộng năm 2022 tại Ninh Bình,https://nhandan.vn/lien-hoan-hat-xam-mo-rong-nam-2022-tai-ninh-binh-post715636.html
Lời tự tình của đá,https://nhandan.vn/loi-tu-tinh-cua-da-post715609.html
Nửa thế kỷ ươm mầm tài năng trẻ cho thành phố Cảng,https://nhandan.vn/nua-the-ky-uom-mam-tai-nang-tre-cho-thanh-pho-cang-post715582.html
"Hội thảo Quản lý hoạt động dịch vụ phát thanh, truyền hình",https://nhandan.vn/hoi-thao-quan-ly-hoat-dong-dich-vu-phat-thanh-truyen-hinh-post715580.html
Những vần thơ Bác Hồ gửi các cháu thiếu nhi dịp Tết Trung thu,https://nhandan.vn/nhung-van-tho-bac-ho-gui-cac-chau-thieu-nhi-dip-tet-trung-thu-post714603.html
Sinh hoạt cộng đồng Tết Trung thu,https://nhandan.vn/sinh-hoat-cong-dong-tet-trung-thu-post714541.html
Nguồn gốc và ý nghĩa của Tết Trung thu,https://nhandan.vn/nguon-goc-va-y-nghia-cua-tet-trung-thu-post714555.html
Mâm ngũ quả,https://nhandan.vn/mam-ngu-qua-post714554.html
Bánh Trung thu,https://nhandan.vn/banh-trung-thu-post714553.html
Những vần thơ Bác Hồ gửi các cháu thiếu nhi dịp Tết Trung thu,https://nhandan.vn/nhung-van-tho-bac-ho-gui-cac-chau-thieu-nhi-dip-tet-trung-thu-post714603.html
,https://nhandan.vn/tet-trung-thu-net-truyen-thong-giua-bien-thien-lich-su-post714552.html
,https://nhandan.vn/do-choi-noi-phu-do-pho-hang-ma-truoc-tet-trung-thu-post711491.html
Móng Cái: Không còn là điểm du lịch quá xa xôi,https://nhandan.vn/mong-cai-khong-con-la-diem-du-lich-qua-xa-xoi-post715494.html
Quảng Bình thúc đẩy hợp tác phát triển du lịch hang động 2 nước Việt Nam-Lào,https://nhandan.vn/quang-binh-thuc-day-hop-tac-phat-trien-du-lich-hang-dong-2-nuoc-viet-nam-lao-post715536.html
Long An: Gần 200 gian hàng tham gia Lễ hội ẩm thực đường phố và Hội chợ OCOP,https://nhandan.vn/long-an-gan-200-gian-hang-tham-gia-le-hoi-am-thuc-duong-pho-va-hoi-cho-ocop-post715686.html
Khai hội “Hương cốm mùa thu vàng” trên cao nguyên trắng Bắc Hà,https://nhandan.vn/khai-hoi-huong-com-mua-thu-vang-tren-cao-nguyen-trang-bac-ha-post715698.html
,https://nhandan.vn/thu-cua-chu-tich-nuoc-nguyen-xuan-phuc-gui-cac-chau-thieu-nien-nhi-dong-nhan-dip-tet-trung-thu-nam-2022-post714441.html
,https://nhandan.vn/anh-doc-dao-mua-lan-choi-trung-thu-noi-ngoai-thanh-ha-noi-post714342.html
,https://nhandan.vn/pho-chu-tich-nuoc-vo-thi-anh-xuan-vui-tet-trung-thu-voi-hoc-sinh-yen-bai-post714366.html
Ký kết quảng bá phim tài liệu Việt Nam trên Truyền hình Quốc hội,https://nhandan.vn/ky-ket-quang-ba-phim-tai-lieu-viet-nam-tren-truyen-hinh-quoc-hoi-post715563.html
Sôi động lễ hội Tango quốc tế 2022,https://nhandan.vn/soi-dong-le-hoi-tango-quoc-te-2022-post715560.html
Ngắm 3 bảo vật quốc gia hàng đầu của Hàn Quốc tại Bảo tàng Lịch sử quốc gia Việt Nam,https://nhandan.vn/ngam-3-bao-vat-quoc-gia-hang-dau-cua-han-quoc-tai-bao-tang-lich-su-quoc-gia-viet-nam-post715558.html
"Hà Giang quảng bá những giá trị di sản văn hóa, địa chất tiêu biểu tại Đắk Lắk",https://nhandan.vn/ha-giang-quang-ba-nhung-gia-tri-di-san-van-hoa-dia-chat-tieu-bieu-tai-dak-lak-post715501.html
Đa sắc màu Trung thu châu Á,https://nhandan.vn/da-sac-mau-trung-thu-chau-a-post714557.html
Tết Trung thu: Nét truyền thống giữa biến thiên lịch sử,https://nhandan.vn/tet-trung-thu-net-truyen-thong-giua-bien-thien-lich-su-post714552.html
Nguồn gốc và ý nghĩa của Tết Trung thu,https://nhandan.vn/nguon-goc-va-y-nghia-cua-tet-trung-thu-post714555.html
Mâm ngũ quả,https://nhandan.vn/mam-ngu-qua-post714554.html
Bánh Trung thu,https://nhandan.vn/banh-trung-thu-post714553.html
Đồ chơi Trung thu,https://nhandan.vn/do-choi-trung-thu-post714546.html
"Đồng dao về ông ""Giăng""",https://nhandan.vn/dong-dao-ve-ong-giang-post714259.html
Đại diện Việt Nam Bùi Quỳnh Hoa giành giải Siêu mẫu quốc tế 2022,https://nhandan.vn/dai-dien-viet-nam-bui-quynh-hoa-gianh-giai-sieu-mau-quoc-te-2022-post715428.html
Đĩa cốm xào cho tròn thu Hà Nội,https://nhandan.vn/dia-com-xao-cho-tron-thu-ha-noi-post715498.html
"Hà Giang quảng bá những giá trị di sản văn hóa, địa chất tiêu biểu tại Đắk Lắk",https://nhandan.vn/ha-giang-quang-ba-nhung-gia-tri-di-san-van-hoa-dia-chat-tieu-bieu-tai-dak-lak-post715501.html
Thanh Hóa tổ chức Lễ hội Lam Kinh năm 2022,https://nhandan.vn/thanh-hoa-to-chuc-le-hoi-lam-kinh-nam-2022-post715680.html
Liên hoan hát Xẩm mở rộng năm 2022 tại Ninh Bình,https://nhandan.vn/lien-hoan-hat-xam-mo-rong-nam-2022-tai-ninh-binh-post715636.html
[Ảnh] Tưng bừng lễ hội đua bò truyền thống của đồng bào Khmer,https://nhandan.vn/anh-tung-bung-le-hoi-dua-bo-truyen-thong-cua-dong-bao-khmer-post715800.html
[Ảnh] Tưng bừng lễ hội đua bò truyền thống của đồng bào Khmer,https://nhandan.vn/anh-tung-bung-le-hoi-dua-bo-truyen-thong-cua-dong-bao-khmer-post715800.html
[Ảnh] Ùn ứ giao thông tại làn xe công nghệ sân bay Tân Sơn Nhất,https://nhandan.vn/anh-un-u-giao-thong-tai-lan-xe-cong-nghe-san-bay-tan-son-nhat-post715801.html
"Sương mù bao trùm Hà Nội, mức độ ô nhiễm không khí cao",https://nhandan.vn/suong-mu-bao-trum-ha-noi-muc-do-o-nhiem-khong-khi-cao-post715743.html
[Ảnh] Khai mạc Diễn đàn Kinh tế-Xã hội Việt Nam 2022,https://nhandan.vn/anh-khai-mac-dien-dan-kinh-te-xa-hoi-viet-nam-2022-post715741.html
"[Ảnh] Mưu sinh ở ""thủ phủ"" phế liệu nhựa ven đô Hà Nội",https://nhandan.vn/anh-muu-sinh-o-thu-phu-phe-lieu-nhua-ven-do-ha-noi-post715540.html
,https://nhandan.vn/pho-chu-tich-nuoc-vo-thi-anh-xuan-vui-tet-trung-thu-voi-hoc-sinh-yen-bai-post714366.html
Hậu Giang chuyển mạnh từ “chính quyền quản lý” sang “chính quyền phục vụ”,https://nhandan.vn/hau-giang-chuyen-manh-tu-chinh-quyen-quan-ly-sang-chinh-quyen-phuc-vu-post715756.html
Tăng nguồn lực hỗ trợ người nghèo,https://nhandan.vn/tang-nguon-luc-ho-tro-nguoi-ngheo-post715718.html
Kỷ niệm 55 năm Củ Chi được phong tặng danh hiệu “Đất thép thành đồng”,https://nhandan.vn/ky-niem-55-nam-cu-chi-duoc-phong-tang-danh-hieu-dat-thep-thanh-dong-post715672.html
"Phát huy tinh thần trách nhiệm, triển khai nhanh các công trình, dự án giao thông trọng điểm",https://nhandan.vn/phat-huy-tinh-than-trach-nhiem-trien-khai-nhanh-cac-cong-trinh-du-an-giao-thong-trong-diem-post715671.html
Đại diện Việt Nam Bùi Quỳnh Hoa giành giải Siêu mẫu quốc tế 2022,https://nhandan.vn/dai-dien-viet-nam-bui-quynh-hoa-gianh-giai-sieu-mau-quoc-te-2022-post715428.html
Đĩa cốm xào cho tròn thu Hà Nội,https://nhandan.vn/dia-com-xao-cho-tron-thu-ha-noi-post715498.html
"Hà Giang quảng bá những giá trị di sản văn hóa, địa chất tiêu biểu tại Đắk Lắk",https://nhandan.vn/ha-giang-quang-ba-nhung-gia-tri-di-san-van-hoa-dia-chat-tieu-bieu-tai-dak-lak-post715501.html
Thanh Hóa tổ chức Lễ hội Lam Kinh năm 2022,https://nhandan.vn/thanh-hoa-to-chuc-le-hoi-lam-kinh-nam-2022-post715680.html
Những vần thơ Bác Hồ gửi các cháu thiếu nhi dịp Tết Trung thu,https://nhandan.vn/nhung-van-tho-bac-ho-gui-cac-chau-thieu-nhi-dip-tet-trung-thu-post714603.html
Sinh hoạt cộng đồng Tết Trung thu,https://nhandan.vn/sinh-hoat-cong-dong-tet-trung-thu-post714541.html
Nguồn gốc và ý nghĩa của Tết Trung thu,https://nhandan.vn/nguon-goc-va-y-nghia-cua-tet-trung-thu-post714555.html
Mâm ngũ quả,https://nhandan.vn/mam-ngu-qua-post714554.html
Bánh Trung thu,https://nhandan.vn/banh-trung-thu-post714553.html
Những vần thơ Bác Hồ gửi các cháu thiếu nhi dịp Tết Trung thu,https://nhandan.vn/nhung-van-tho-bac-ho-gui-cac-chau-thieu-nhi-dip-tet-trung-thu-post714603.html
5 mẹo nhỏ để thực hiện du lịch bền vững,https://nhandan.vn/5-meo-nho-de-thuc-hien-du-lich-ben-vung-post715664.html
5 mẹo nhỏ để thực hiện du lịch bền vững,https://nhandan.vn/5-meo-nho-de-thuc-hien-du-lich-ben-vung-post715664.html
Long An khai mạc Tuần Văn hóa-Du lịch 2022,https://nhandan.vn/long-an-khai-mac-tuan-van-hoa-du-lich-2022-post715701.html
Khai hội “Hương cốm mùa thu vàng” trên cao nguyên trắng Bắc Hà,https://nhandan.vn/khai-hoi-huong-com-mua-thu-vang-tren-cao-nguyen-trang-bac-ha-post715698.html
Long An: Gần 200 gian hàng tham gia Lễ hội ẩm thực đường phố và Hội chợ OCOP,https://nhandan.vn/long-an-gan-200-gian-hang-tham-gia-le-hoi-am-thuc-duong-pho-va-hoi-cho-ocop-post715686.html
Quảng Bình thúc đẩy hợp tác phát triển du lịch hang động 2 nước Việt Nam-Lào,https://nhandan.vn/quang-binh-thuc-day-hop-tac-phat-trien-du-lich-hang-dong-2-nuoc-viet-nam-lao-post715536.html
Móng Cái: Không còn là điểm du lịch quá xa xôi,https://nhandan.vn/mong-cai-khong-con-la-diem-du-lich-qua-xa-xoi-post715494.html
Đà Nẵng tích hợp điểm đến du lịch trên không gian vũ trụ ảo,https://nhandan.vn/da-nang-tich-hop-diem-den-du-lich-tren-khong-gian-vu-tru-ao-post715316.html
Tìm kiếm các ứng cử viên cho Giải thưởng Du lịch ASEAN 2023,https://nhandan.vn/tim-kiem-cac-ung-cu-vien-cho-giai-thuong-du-lich-asean-2023-post715323.html
,https://nhandan.vn/hau-giang-to-chuc-vui-tet-trung-thu-cho-cac-em-thieu-nien-nhi-dong-post714346.html
[Ảnh] Tưng bừng lễ hội đua bò truyền thống của đồng bào Khmer,https://nhandan.vn/anh-tung-bung-le-hoi-dua-bo-truyen-thong-cua-dong-bao-khmer-post715800.html
[Ảnh] Ùn ứ giao thông tại làn xe công nghệ sân bay Tân Sơn Nhất,https://nhandan.vn/anh-un-u-giao-thong-tai-lan-xe-cong-nghe-san-bay-tan-son-nhat-post715801.html
"Sương mù bao trùm Hà Nội, mức độ ô nhiễm không khí cao",https://nhandan.vn/suong-mu-bao-trum-ha-noi-muc-do-o-nhiem-khong-khi-cao-post715743.html
[Ảnh] Khai mạc Diễn đàn Kinh tế-Xã hội Việt Nam 2022,https://nhandan.vn/anh-khai-mac-dien-dan-kinh-te-xa-hoi-viet-nam-2022-post715741.html
"[Ảnh] Mưu sinh ở ""thủ phủ"" phế liệu nhựa ven đô Hà Nội",https://nhandan.vn/anh-muu-sinh-o-thu-phu-phe-lieu-nhua-ven-do-ha-noi-post715540.html
[Ảnh] Thủ tướng Phạm Minh Chính chủ trì Hội nghị Thủ tướng Chính phủ với doanh nghiệp đầu tư nước ngoài,https://nhandan.vn/anh-thu-tuong-pham-minh-chinh-chu-tri-hoi-nghi-thu-tuong-chinh-phu-voi-doanh-nghiep-dau-tu-nuoc-ngoai-post715656.html
Tuyên ngôn Độc lập: Thời khắc lịch sử và ý nghĩa trường tồn,https://nhandan.vn/tuyen-ngon-doc-lap-thoi-khac-lich-su-va-y-nghia-truong-ton-post713397.html
Toàn văn Bản Tuyên ngôn độc lập,https://nhandan.vn/toan-van-ban-tuyen-ngon-doc-lap-post713015.html
Cờ đỏ sao vàng – biểu tượng thiêng liêng đặc biệt của dân tộc Việt Nam,https://nhandan.vn/co-do-sao-vang-bieu-tuong-thieng-lieng-dac-biet-cua-dan-toc-viet-nam-post712980.html
Nhạc sĩ Văn Cao và sự ra đời bài “Tiến quân ca”,https://nhandan.vn/nhac-si-van-cao-va-su-ra-doi-bai-tien-quan-ca-post712842.html
Nền tảng cho tương lai,https://nhandan.vn/nen-tang-cho-tuong-lai-post710903.html
Việt Nam Chính thức trở thành nước có định danh điện tử quốc gia,https://nhandan.vn/viet-nam-chinh-thuc-tro-thanh-nuoc-co-dinh-danh-dien-tu-quoc-gia-post710849.html
Ứng dụng chuyển đổi số thiết thực vào cuộc sống,https://nhandan.vn/ung-dung-chuyen-doi-so-thiet-thuc-vao-cuoc-song-post710676.html
Bánh đa nem Nam Chi tỉnh Hà Tĩnh,https://nhandan.vn/banh-da-nem-nam-chi-tinh-ha-tinh-post710973.html
Trao 5 giải A tại liên hoan hát Xẩm mở rộng năm 2022,https://nhandan.vn/trao-5-giai-a-tai-lien-hoan-hat-xam-mo-rong-nam-2022-post715757.html
Chương trình hòa nhạc “Giai điệu Tây Ban Nha” tại Hà Nội,https://nhandan.vn/chuong-trinh-hoa-nhac-giai-dieu-tay-ban-nha-tai-ha-noi-post715748.html
Món ăn kết hợp văn hóa Việt Nam-Hoa Kỳ giành giải Nhất cuộc thi “Sáng tạo hương vị mùa hè cùng việt quất Hoa Kỳ”,https://nhandan.vn/mon-an-ket-hop-van-hoa-viet-nam-hoa-ky-gianh-giai-nhat-cuoc-thi-sang-tao-huong-vi-mua-he-cung-viet-quat-hoa-ky-post715745.html
Sơn La vinh danh “Nghệ thuật xòe Thái”- di sản văn hóa phi vật thể đại diện của nhân loại,https://nhandan.vn/son-la-vinh-danh-nghe-thuat-xoe-thai-di-san-van-hoa-phi-vat-the-dai-dien-cua-nhan-loai-post715706.html
Đọc sách: “Khai nguyên rồng tiên”,https://nhandan.vn/doc-sach-khai-nguyen-rong-tien-post715676.html
Trao giải và triển lãm ảnh nghệ thuật “Huế - Những góc nhìn mới”,https://nhandan.vn/trao-giai-va-trien-lam-anh-nghe-thuat-hue-nhung-goc-nhin-moi-post715684.html
Thanh Hóa tổ chức Lễ hội Lam Kinh năm 2022,https://nhandan.vn/thanh-hoa-to-chuc-le-hoi-lam-kinh-nam-2022-post715680.html
Liên hoan hát Xẩm mở rộng năm 2022 tại Ninh Bình,https://nhandan.vn/lien-hoan-hat-xam-mo-rong-nam-2022-tai-ninh-binh-post715636.html
[Ảnh] Thủ tướng Phạm Minh Chính chủ trì Hội nghị Thủ tướng Chính phủ với doanh nghiệp đầu tư nước ngoài,https://nhandan.vn/anh-thu-tuong-pham-minh-chinh-chu-tri-hoi-nghi-thu-tuong-chinh-phu-voi-doanh-nghiep-dau-tu-nuoc-ngoai-post715656.html
[Ảnh] Chủ tịch nước tiếp một số nhà khoa học quốc tế,https://nhandan.vn/anh-chu-tich-nuoc-tiep-mot-so-nha-khoa-hoc-quoc-te-post715585.html
"Kỷ niệm 55 năm Long An “Trung dũng kiên cường, toàn dân đánh giặc”",https://nhandan.vn/ky-niem-55-nam-long-an-trung-dung-kien-cuong-toan-dan-danh-giac-post715651.html
Liên hoan hát Xẩm mở rộng năm 2022 tại Ninh Bình,https://nhandan.vn/lien-hoan-hat-xam-mo-rong-nam-2022-tai-ninh-binh-post715636.html
[Ảnh] Tưng bừng lễ hội đua bò truyền thống của đồng bào Khmer,https://nhandan.vn/anh-tung-bung-le-hoi-dua-bo-truyen-thong-cua-dong-bao-khmer-post715800.html
Trao 5 giải A tại liên hoan hát Xẩm mở rộng năm 2022,https://nhandan.vn/trao-5-giai-a-tai-lien-hoan-hat-xam-mo-rong-nam-2022-post715757.html
Chương trình hòa nhạc “Giai điệu Tây Ban Nha” tại Hà Nội,https://nhandan.vn/chuong-trinh-hoa-nhac-giai-dieu-tay-ban-nha-tai-ha-noi-post715748.html
Món ăn kết hợp văn hóa Việt Nam-Hoa Kỳ giành giải Nhất cuộc thi “Sáng tạo hương vị mùa hè cùng việt quất Hoa Kỳ”,https://nhandan.vn/mon-an-ket-hop-van-hoa-viet-nam-hoa-ky-gianh-giai-nhat-cuoc-thi-sang-tao-huong-vi-mua-he-cung-viet-quat-hoa-ky-post715745.html
Đa sắc màu Trung thu châu Á,https://nhandan.vn/da-sac-mau-trung-thu-chau-a-post714557.html
Tết Trung thu: Nét truyền thống giữa biến thiên lịch sử,https://nhandan.vn/tet-trung-thu-net-truyen-thong-giua-bien-thien-lich-su-post714552.html
Sinh hoạt cộng đồng Tết Trung thu,https://nhandan.vn/sinh-hoat-cong-dong-tet-trung-thu-post714541.html
Mâm ngũ quả,https://nhandan.vn/mam-ngu-qua-post714554.html
Bánh Trung thu,https://nhandan.vn/banh-trung-thu-post714553.html
Đồ chơi Trung thu,https://nhandan.vn/do-choi-trung-thu-post714546.html
Việt Nam lọt top 10 điểm đến hàng đầu của du khách Australia,https://nhandan.vn/viet-nam-lot-top-10-diem-den-hang-dau-cua-du-khach-australia-post715321.html
Singapore: Vườn chim Jurong sẽ đóng cửa vào đầu năm 2023,https://nhandan.vn/singapore-vuon-chim-jurong-se-dong-cua-vao-dau-nam-2023-post715155.html
Không gian Tây Bắc giữa lòng Hà Nội,https://nhandan.vn/khong-gian-tay-bac-giua-long-ha-noi-post715104.html
[Ảnh] Chủ tịch nước tiếp một số nhà khoa học quốc tế,https://nhandan.vn/anh-chu-tich-nuoc-tiep-mot-so-nha-khoa-hoc-quoc-te-post715585.html
"[Ảnh] Hội nghị toàn quốc về cải cách thủ tục hành chính, phục vụ người dân, doanh nghiệp",https://nhandan.vn/anh-hoi-nghi-toan-quoc-ve-cai-cach-thu-tuc-hanh-chinh-phuc-vu-nguoi-dan-doanh-nghiep-post715388.html
[Ảnh] Lần đầu tiên Lào-Việt Nam-Campuchia diễn tập cứu hộ-cứu nạn chung,https://nhandan.vn/anh-lan-dau-tien-lao-viet-nam-campuchia-dien-tap-cuu-ho-cuu-nan-chung-post715334.html
,https://nhandan.vn/nghia-trang-liet-si-doc-ba-dac-xot-long-nhung-ngoi-mo-vo-danh-post707386.html
,https://nhandan.vn/nhung-noi-dau-chua-bao-gio-nguoi-ngoai-post707047.html
,https://nhandan.vn/nguoi-linh-gia-hon-20-nam-tim-dong-doi-tren-dat-ban-campuchia-post707143.html
Hình mẫu vì hòa bình và phát triển,https://nhandan.vn/hinh-mau-vi-hoa-binh-va-phat-trien-post715531.html
Công tác cán bộ là giải pháp căn cơ,https://nhandan.vn/cong-tac-can-bo-la-giai-phap-can-co-post715340.html
Chìa khóa quản trị nguồn nước châu thổ Cửu Long,https://nhandan.vn/chia-khoa-quan-tri-nguon-nuoc-chau-tho-cuu-long-post715338.html
Không ai đánh người chạy lại!,https://nhandan.vn/khong-ai-danh-nguoi-chay-lai!-post715343.html
Cô gái Mường và trái quýt thơm thảo,https://nhandan.vn/co-gai-muong-va-trai-quyt-thom-thao-post701942.html
Cô gái Mường và trái quýt thơm thảo,https://nhandan.vn/co-gai-muong-va-trai-quyt-thom-thao-post701942.html
"Hiểu rõ căn nguyên, ứng xử phù hợp",https://nhandan.vn/hieu-ro-can-nguyen-ung-xu-phu-hop-post701944.html
Chủ tịch nước kết thúc chuyến thăm Cuba và dự Phiên thảo luận Đại hội đồng LHQ,https://nhandan.vn/chu-tich-nuoc-ket-thuc-chuyen-tham-cuba-va-du-phien-thao-luan-dai-hoi-dong-lhq-post666752.html
Khẳng định mạnh mẽ một Việt Nam khát vọng phát triển và có trách nhiệm,https://nhandan.vn/khang-dinh-manh-me-mot-viet-nam-khat-vong-phat-trien-va-co-trach-nhiem-post666723.html
Chủ tịch nước Nguyễn Xuân Phúc dự khai mạc Phiên thảo luận chung cấp cao Đại hội đồng Liên hợp quốc,https://nhandan.vn/chu-tich-nuoc-nguyen-xuan-phuc-du-khai-mac-phien-thao-luan-chung-cap-cao-dai-hoi-dong-lien-hop-quoc-post666046.html
Tuyên bố chung Việt Nam - Cuba,https://nhandan.vn/tuyen-bo-chung-viet-nam-cuba-post665982.html
Xây dựng môi trường học tập lành mạnh,https://nhandan.vn/xay-dung-moi-truong-hoc-tap-lanh-manh-post715793.html
Lời tự tình của đá,https://nhandan.vn/loi-tu-tinh-cua-da-post715609.html
Nửa thế kỷ ươm mầm tài năng trẻ cho thành phố Cảng,https://nhandan.vn/nua-the-ky-uom-mam-tai-nang-tre-cho-thanh-pho-cang-post715582.html
"Hội thảo Quản lý hoạt động dịch vụ phát thanh, truyền hình",https://nhandan.vn/hoi-thao-quan-ly-hoat-dong-dich-vu-phat-thanh-truyen-hinh-post715580.html
Ký kết quảng bá phim tài liệu Việt Nam trên Truyền hình Quốc hội,https://nhandan.vn/ky-ket-quang-ba-phim-tai-lieu-viet-nam-tren-truyen-hinh-quoc-hoi-post715563.html
Sôi động lễ hội Tango quốc tế 2022,https://nhandan.vn/soi-dong-le-hoi-tango-quoc-te-2022-post715560.html
Ngắm 3 bảo vật quốc gia hàng đầu của Hàn Quốc tại Bảo tàng Lịch sử quốc gia Việt Nam,https://nhandan.vn/ngam-3-bao-vat-quoc-gia-hang-dau-cua-han-quoc-tai-bao-tang-lich-su-quoc-gia-viet-nam-post715558.html
"Hà Giang quảng bá những giá trị di sản văn hóa, địa chất tiêu biểu tại Đắk Lắk",https://nhandan.vn/ha-giang-quang-ba-nhung-gia-tri-di-san-van-hoa-dia-chat-tieu-bieu-tai-dak-lak-post715501.html
